"「サウナ入浴」と呼ばれることもあるサウナの利用は、極度の熱に短期間受動的にさらされることが特徴である。この熱にさらされることによって、軽度の高体温-深部体温の上昇-を引き起こし、神経内分泌、心血管系、細胞保護機構を含む体温調節反応を誘発し、ホメオスタシスを回復させ、将来の熱ストレス要因に備えて身体を整える...ここ数十年、サウナ入浴は、観察研究、介入研究、機構論的研究から得られた説得力のあるデータに基づき、寿命を延ばし、全身の健康を改善する手段として浮上してきた。特に興味深いのは、クオピオ虚血性心疾患危険因子 (KIHD) 研究の参加者を対象とした研究結果である。これは、フィンランド東部の中年男性2,300人以上を対象とした健康アウトカムに関する現在進行中の前向き集団ベースコホート研究で、サウナ利用と死亡や疾病の減少との間に強い関連性があることが確認されている...KIHDの結果は、週に2～3回サウナを利用した男性は、サウナを利用しなかった男性より心疾患関連要因による死亡が27％少なかったことを示した。[2]さらに、彼らが経験した恩恵は用量依存的であることが判明した：サウナを約2倍の頻度、週に約4～7回利用した男性は、約2倍の恩恵を受け、心疾患関連要因による死亡が50%低かった。[2]さらに、サウナを頻繁に利用する人は、すべての早死の原因による死亡率が40％低いことがわかった。これらの結果は、男性の健康に影響を及ぼす可能性のある年齢、活動レベル、ライフスタイルの要因を考慮しても同様であった。[2]...KIHDはまた、サウナを頻繁に利用することで、認知症やアルツハイマー病の発症リスクが用量依存的に低下することも明らかにした。週に2～3回サウナを利用する男性は、週に1回しかサウナを利用しない男性に比べて、認知症の発症リスクが66％、アルツハイマー病の発症リスクが65％低かった...サウナ利用に関連する健康上の利点は、精神的健康の他の側面にも及んだ。KIHD研究に参加した男性のうち、週に4～7回サウナを利用した男性は、食生活、社会経済的状況、身体活動、炎症状態 (C反応性タンパク質で測定) にかかわらず、精神病性障害を発症する可能性が77％低かった...高温にさらされると身体にストレスがかかり、迅速で強固な反応が引き起こされる。皮膚と深部の体温が著しく上昇し、発汗が起こる。まず皮膚が熱くなり、40℃ (104°F) まで上昇し、次に深部体温の変化が起こり、37℃ (98.6°F、平熱) から38℃ (100.4°F) までゆっくりと上昇し、その後39℃ (102.2°F) まで急速に上昇する...心拍数 (1分間の拍動数) は増加し、一回拍出量 (血液を送り出す量) は変化しないが、心拍出量 (酸素を必要とする身体に応じて心臓が行う仕事量の指標) は60～70％増加する。[5]この間、身体の血流の約50～70％は、発汗を促進するために、深部から皮膚に再分配される。平均的な人は、サウナ入浴中に約0.5kgの汗をかく。[11]急性熱曝露はまた、中核血液量の減少を緩和するために、血漿量全体の一過性の増加を引き起こす。この血漿量の増加は、発汗のための予備的な水分源となるだけでなく、自動車のラジエーターの水のような役割も果たし、深部体温の急激な上昇を防ぐために身体を冷却し、暑さへの耐性を促進する...サウナの利用を繰り返すことで、身体が暑さに順応し、将来の暴露に対する身体の反応が最適化されるが、これはおそらくホルミシス (ストレス要因の大きさに不相応な軽度のストレス要因にさらされた後の代償性の防御反応) として知られる生物学的現象によるものである。ホルミシスは、細胞の損傷を修復するだけでなく、その後のより破壊的なストレス要因への暴露から身を守るための、膨大な数の防御メカニズムを引き起こす...サウナ利用による生理学的反応は、中程度から強度の運動中に経験するものと驚くほどよく似ている。実際、サウナの利用は、慢性疾患や身体的制限のために運動ができない人のための、運動の代替手段として提案されている。[13]

この記事に基づき、サウナ利用後に人が行うべき重要なことは何か?",冷水のシャワーを浴びる。,運動する。,食事をする。,ろ過した水で水分を補給する。,D
次のうち、アミノ酸ではないものはどれか?,グルタミン酸,アスパラギン酸,グルタミン,パルミチン酸,D
ある運動選手の定常酸素摂取量が5分間の運動で平均3.0l/分の場合、消費されるエネルギーはおよそ何kJか?,60 kJ,150 kJ,300 kJ,500 kJ,C
食事における炭水化物の摂取量が少ないことについて、正しい記述を以下から選択せよ。,10分未満の競技では運動能力に影響を与えない。,安静時筋pHに影響する。,高強度の運動能力を損なう可能性がある。,運動中の筋グリコーゲンへの依存度が高くなる。,C
翻訳後にタンパク質の構造を変化させるために用いられないプロセスは次のうちどれか?,脂質化。,ペプチド結合によるさらなるアミノ酸の付加。,糖鎖付加,リン酸化。,B
筋肉によるグルコースとアミノ酸の取り込みを促進するのは次のうちどれか?,アドレナリン,インスリン,グリコーゲン,コルチゾール,B
分岐鎖アミノ酸が筋肉中で脱アミノ化されるとき、生成されるアンモニアの大部分について正しい説明を以下から選択せよ。,アルギニンに変換され、筋肉から放出される。,アラニンとグルタミンに変換され、筋肉から放出される。,尿素に変換され、筋肉から放出される。,筋肉でプリンやピリミジンを合成するのに用いられる。,B
ある分子が、電子伝達鎖の最終酵素であるチトクロム酸化酵素A3に結合することによって作用する。この物質をヒトに大量に投与するときに予想されることについて、正しいものを以下から選択せよ。,細胞が電子を酸素に渡すことができなくなり、好気呼吸が停止して細胞を窒息死させ、死に至る。,ATP合成酵素でリン酸基を受容するADPの供給不足により死に至る。,ブロックされた生化学的経路を回避するために、細胞が代謝する主要栄養素を切り替えるため、効果がない。,負帰還により細胞が嫌気性経路をアップレギュレートするため、細胞のATP産生を増加させる。,A
極度の精神的外傷の期間に反応して、患者は、切り離された感覚を経験し始める。彼は言う、「それが起こっている間、現実でないような気がした。自分では何もコントロールできず、ただ私自身がそれをするのを見ているだけだった。つまり、その、起こっていることは分かっていたのだが、起こっているようには感じなかった」。この患者が述べているものとして、正しいものを以下から選択せよ。,解離性同一性障害,不安障害,離人症性障害,統合失調症エピソード,C
持久力トレーニングは筋肉のどのような能力を高めるか?,より速く収縮する。,ホスホクレアチンを分解する。,脂肪と炭水化物を燃焼させる。,嫌気的にエネルギーを生成する。,C
代謝を決定するものは以下の内どれか?,細胞内のタンパク質の大きさ。,利用可能なアミノ酸。,遺伝物質の指示通りに形成されるタンパク質。,リボ核酸のアミノ酸組成。,C
"知覚される音の周波数のドップラーシフトを決定するためには、以下のどの変数を知る必要があるか? 
I. 媒質中の音速 
II. 音源と検出器間の相互作用の時間 
III. 音源と検出器間の距離 
IV. 放射される音の周波数",Iのみ,IとIII,IIとIV,IとIV,D
マラソンを成功させる鍵となる属性は以下の内どれか?,強さ。,パワー。,歩幅の長さ。,スタミナ。,D
"減数分裂と有糸分裂を行う細胞に共通する相は次のうちどれか? 
I. G0 
II. G2期 
III. S期",Iのみ,IとIIのみ,IIとIIIのみ,I、II、III,C
ある男子選手のトレーニングセッション中の平均酸素消費量が2l/分であった場合、その選手のおおよそのエネルギー消費量を以下から選択せよ。,400 kJ/分,200 kJ/分,80 kJ/分,40 kJ/分,D
DNAの二本鎖分子において、プリン：ピリミジンの比率を以下から選択せよ。,変化する。,RNAの塩基配列によって決まる。,遺伝的に決定される。,常に1:1である。,D
"「サウナ入浴」と呼ばれることもあるサウナの利用は、極度の熱に短期間受動的にさらされることが特徴である。この熱にさらされることによって、軽度の高体温-深部体温の上昇-を引き起こし、神経内分泌、心血管系、細胞保護機構を含む体温調節反応を誘発し、ホメオスタシスを回復させ、将来の熱ストレス要因に備えて身体を整える...ここ数十年、サウナ入浴は、観察研究、介入研究、機構論的研究から得られた説得力のあるデータに基づき、寿命を延ばし、全身の健康を改善する手段として浮上してきた。特に興味深いのは、クオピオ虚血性心疾患危険因子 (KIHD) 研究の参加者を対象とした研究結果である。これは、フィンランド東部の中年男性2,300人以上を対象とした健康アウトカムに関する現在進行中の前向き集団ベースコホート研究で、サウナ利用と死亡や疾病の減少との間に強い関連性があることが確認されている...KIHDの結果は、週に2～3回サウナを利用した男性は、サウナを利用しなかった男性より心疾患関連要因による死亡が27％少なかったことを示した。[2]さらに、彼らが経験した恩恵は用量依存的であることが判明した：サウナを約2倍の頻度、週に約4～7回利用した男性は、約2倍の恩恵を受け、心疾患関連要因による死亡が50%低かった。[2]さらに、サウナを頻繁に利用する人は、すべての早死の原因による死亡率が40％低いことがわかった。これらの結果は、男性の健康に影響を及ぼす可能性のある年齢、活動レベル、ライフスタイルの要因を考慮しても同様であった。[2]...KIHDはまた、サウナを頻繁に利用することで、認知症やアルツハイマー病の発症リスクが用量依存的に低下することも明らかにした。週に2～3回サウナを利用する男性は、週に1回しかサウナを利用しない男性に比べて、認知症の発症リスクが66％、アルツハイマー病の発症リスクが65％低かった...サウナ利用に関連する健康上の利点は、精神的健康の他の側面にも及んだ。KIHD研究に参加した男性のうち、週に4～7回サウナを利用した男性は、食生活、社会経済的状況、身体活動、炎症状態 (C反応性タンパク質で測定) にかかわらず、精神病性障害を発症する可能性が77％低かった...高温にさらされると身体にストレスがかかり、迅速で強固な反応が引き起こされる。皮膚と深部の体温が著しく上昇し、発汗が起こる。まず皮膚が熱くなり、40℃ (104°F) まで上昇し、次に深部体温の変化が起こり、37℃ (98.6°F、平熱) から38℃ (100.4°F) までゆっくりと上昇し、その後39℃ (102.2°F) まで急速に上昇する...心拍数 (1分間の拍動数) は増加し、一回拍出量 (血液を送り出す量) は変化しないが、心拍出量 (酸素を必要とする身体に応じて心臓が行う仕事量の指標) は60～70％増加する。[5]この間、身体の血流の約50～70％は、発汗を促進するために、深部から皮膚に再分配される。平均的な人は、サウナ入浴中に約0.5kgの汗をかく。[11]急性熱曝露はまた、中核血液量の減少を緩和するために、血漿量全体の一過性の増加を引き起こす。この血漿量の増加は、発汗のための予備的な水分源となるだけでなく、自動車のラジエーターの水のような役割も果たし、深部体温の急激な上昇を防ぐために身体を冷却し、暑さへの耐性を促進する...サウナの利用を繰り返すことで、身体が暑さに順応し、将来の暴露に対する身体の反応が最適化されるが、これはおそらくホルミシス (ストレス要因の大きさに不相応な軽度のストレス要因にさらされた後の代償性の防御反応) として知られる生物学的現象によるものである。ホルミシスは、細胞の損傷を修復するだけでなく、その後のより破壊的なストレス要因への暴露から身を守るための、膨大な数の防御メカニズムを引き起こす...サウナ利用による生理学的反応は、中程度から強度の運動中に経験するものと驚くほどよく似ている。実際、サウナの利用は、慢性疾患や身体的制限のために運動ができない人のための運動の代替手段として提案されている。[13]

この総説では、サウナ利用の発生率がほとんどの国よりもかなり高いフィンランドの人口調査から多くのデータを得ている。このデータを用いて、フィンランドで他の国よりも妥当性が高いものは次のうちどれか?",青少年スキーの金メダルが多い。,地域社会で尊敬されている86歳の男性市長。,家庭内でのペットの飼育率の増加。,結婚満足度の向上。,B
カレンは大学生で、セラピストと一緒に自尊心と自己効力感を高めることに取り組んでいる。セラピーの3ヵ月後、彼女は状況に対処する能力に大きな変化があることに気づいた。次のうち、セラピストが彼女に自己効力感を高めるために採用するよう求める戦略でないものはどれか?,友人からの肯定的なフィードバックを求める。,上達したい課題を毎日練習する。,彼女の年齢や能力で、彼女が興味を持っている課題を得意としている人を見つける。,不得意な課題を控えて、潜在的な落とし穴を避ける。,D
運動からの回復中のクレアチンリン酸再合成が阻害される要因は以下の内どれか?,クレアチンの過剰,過換気,酸素過剰,酸素不足,D
ある反応の反応物と生成物の両方に薄層クロマトグラフィーを行う。生成物のRf値は反応物より有意に高いことがわかった。この反応を適切に説明できるのは次のうちどれか?,臭化アルキルを塩化アルキルに変換するSN2反応,アルケンをアルコールに変換する付加反応,エステルを無水物に変換する求核アシル置換反応,アルコールをアルケンに変換する脱離反応,D
乳酸、グリセロール、またはアミノ酸からグルコースを合成することを何と呼ぶか,グリコーゲン分解,解糖,脂肪分解,糖新生,D
最大動的運動が有酸素優位になるのはどれくらいの時間の後か?,10秒,30秒,1分,4分,C
水の相図における液体-固体平衡線の負の傾きを最もよく説明するものは次のうちどれか?,H2O(s)はH2O(l)よりも密度が大きく、高圧条件下では固体が液体を形成する。,H2O(s)はH2O(l)よりも密度が大きく、これは水分子間に形成される水素結合によるもの。,H2O(s)はH2O(l)よりも密度が低く、これは水素結合により結晶骨格が形成されるため。,H2O(s)はH2O(l)よりも密度が低く、これは低圧条件下で固体が液体を形成するため。,C
Mg(OH)2を25℃の水500 mLに溶液が完全に飽和するまでゆっくり溶かした。10.0 mLの0.1 M HClを加えると、次のうちどれが起こるか?,MgCl2が沈殿する,Mg(OH)2が沈殿する,Mg(OH)2のKspが増加する,[H2O]が増加する,D
赤色ぼろ線維・ミオクローヌスてんかん (MERRF) は、神経筋系に影響を及ぼす極めてまれな疾患である。MERRFはミトコンドリアDNA (mtDNA) の変異に起因し、タンパク質合成、酸素消費、エネルギー生成を弱める。MERRFに罹患した雄と正常な雌が繁殖した場合、子孫の予想される表現型の比率を最も適切に予測しているのは次のうちどれか?,子孫の誰も罹患しない,すべての雄は罹患し、雌は罹患しない,雄と雌の半数が罹患する,子孫の4分の1が罹患する,A
選択的アンドロゲン受容体モジュレーター(SARM)について、正しいものを以下から選択せよ。,天然のステロイドホルモンの作用を模倣し、アンドロゲン受容体に作用するステロイド薬。,天然のステロイドホルモンの作用に拮抗し、アンドロゲン受容体に作用するステロイド薬。,天然のステロイドホルモンの作用を模倣し、アンドロゲン受容体に作用する非ステロイド系薬剤。,天然のステロイドホルモンの作用を阻害し、アンドロゲン受容体に作用する非ステロイド系薬剤。,C
運動終板に到達した活動電位は何の放出を引き起こすか,神経筋接合部を通過するアセチルコリン。,筋膜上のナトリウム受容体に結合するナトリウムイオン。,筋線維に沿って活動電位を開始させるカルシウムイオン。,筋代謝活動を亢進させるノルアドレナリン。,A
感覚または神経順応の例として、あてはまらないものを以下から選択せよ。,シャツを着た後、しだいに背中の布の感触を感じなくなる。,混雑した部屋に初めて入った後、周囲の会話のざわめきに気を取られなくなる。,晴れた日に初めて外を歩いた後、日光の最初の明るさに目がくらむことはもうない。,解剖学研究室に初めて入った後、ホルムアルデヒドの臭いに気づかなくなる。,C
ある科学者が電極を使って視床下部のニューロン群を刺激し、その膜電位変化を記録している。最初に刺激を与えると膜電位が急激に上昇するのを観察し、その差は100mVであった。最初の刺激の直後に別の刺激を与えても反応はない。しかし、2回目の刺激に供給する電圧の量を増やすと、1回目と同様の反応が観察された。膜電位に関して、2回目の刺激はどのような時間周期に特徴づけられるか?,脱分極,再分極,過分極,静止電位,C
1分子のパルミチン酸CH3(CH2)14CO2Hのβ-酸化について、正しい記述を以下から選択せよ。,8分子のアセチル-CoAと若干のATPと水を生成する。,16分子のアセチル-CoAのみを生成する。,二酸化炭素と水のみを生成する。,酸素を含まない。,A
"この修飾の最も可能性の高い結果は何か? 
﻿
通常、筋細胞へのカリウムの侵入を促進する膜貫通タンパク質を産生するRNA鎖が、別の鎖を産生するように改変される。元の鎖は以下の通りである: 
﻿
 GAAUAGAUGGGAAGCGCCAGAUACAGUAACAGA... 
﻿
修飾された配列は以下の通りである: 
﻿
 GAAUAGAUGGGAAGCGCCAGAUACAGUACCAGA...",タンパク質の欠失,サイズは似ているが機能不全のタンパク質の生成,変化なし,より大きく、機能不全の可能性が高いタンパク質の生成,D
解糖は、以下のうちどの変換を含む経路に与えられた名前か?,グリコーゲンからグルコース-1-リン酸。,グリコーゲンまたはグルコースからフルクトース。,グリコーゲンまたはグルコースからピルビン酸または乳酸。,グリコーゲンまたはグルコースからピルビン酸またはアセチルCoA。,C
"ある心理学者が、被験者に一連の「事実」を学習させる実験を行ったが、それは実際には研究チームによって捏造された記述であった。被験者は、実験が行われている大学の学部生である。被験者は、参加費として10ドルか20ドルが支払われるグループに無作為に振り分けられ、事実を学ぶために15分か30分のどちらかの時間が与えられ、事実を学んだ同じ部屋か、全く異なった不慣れな環境で事実を思い出すよう求められる。この実験の従属変数は次のうちどれか? 
I. 被験者が補償された額。
II. 被験者に事実を思い出させた部屋。
III. 被験者が想起できる事実の数。
IV. 被験者が事実を学ぶために与えられた時間。",IIのみ,IIIのみ,IとIVのみ,IとIIIとIVのみ,B
複数回のスプリント活動における末梢筋疲労の発生に関与していると考えられるのは次のうちどれか?,無機リン酸の蓄積。,筋の高浸透圧化。,抗酸化物質の過剰。,カリウムの不足。,A
筋線維が弛緩するのはいつか?,神経刺激が取り除かれるとき。,神経刺激が強すぎるとき。,アクチン結合部位が露出するとき。,アクチン結合部位が飽和するとき。,A
ピルビン酸デヒドロゲナーゼ複合体について、正しい記述を以下から選択せよ。,筋形質に存在する。,ピルビン酸からアセチルCoAへの変換を触媒する。,ピルビン酸から乳酸への変換を触媒する。,乳酸からピルビン酸への変換を触媒する。,B
水素イオンが形成されるのはいつか?,グリコーゲンが枯渇するとき。,ホスホクレアチンの分解が起こるとき。,ピルビン酸が乳酸に変換されるとき。,解糖がATPを再合成する主要な手段として使用されているとき。,D
私たちの遺伝物質は何からできているか?,デオキシリボ核酸,リボ核酸,二核酸,タンパク質,A
ある日、自分のクリニックで治療を行っている歯科医が、患者の一人と事務員との争いに対処するためにフロントに呼び出された。その患者は中年のビジネスマンで、歯科医ではなく歯科衛生士に診てもらうと言われたことに腹を立て、騒ぎを起こしていた。患者は大声で、自分は大金を稼いでいるのだから、中途半端に訓練された同僚の治療を受ける必要はないとわめく。事務員は歯科医に、患者は予約時間に40分遅れたので、今空いているのは衛生士だけだと説明する。患者は、自分の時間は歯科医院の誰よりも価値があると言い返す。この患者はどのようなパーソナリティ障害を示している可能性が高いか?,演技性,自己愛性,妄想性,強迫性,C
ヴィゴツキーの社会文化的発達理論は、子どもが生まれながらに持っている精神機能と、それを大人として持っているものにどのように発達させていくかという相互作用を説明しようとするものである。その重要な構成要素のひとつが、最近接発達領域である。次の記述のうち、最近接発達領域にある個人を正確に表しているものはどれか?,野球選手はマッスルメモリーを構築するためにティーから野球ボールを打つ。,フルート演奏者が、非常に複雑な終結部を持つ曲をミスなく仕上げることができない。,高校生の英語学習者が、教授による査読のために論文を提出する。,ある高飛び込み選手が、特定の動きのフォームを改善するためにコーチの指導を受ける。,D
より生産的になるためにセラピストと一緒に働いている青年が、成長期を通しての彼の願望の多くと、それが彼にどのように影響を与えたと感じているかを表現している。セラピストは見極めを通して、この青年の発達はある段階に留まっており、それは彼が家をきれいに保てないことに反映されていると考えていると述べる。フロイトの心理性発達理論によると、この青年はどの段階に固執しているだろうか?,肛門,男根,潜伏,性器,B
タンパク質のアミノ酸をつなぐ共有結合の種類は?,ペプチド結合,水素結合,イオン結合,グリコシド結合,A
