1886年にマイルレースの世界記録を樹立したのは誰か?,R・バニスター,S・コー,J・ディマジオ,WG・ジョージ,D
"次の記述のうち、化学的な感覚系を示すものはどれか? 
I. 味覚系 
II. 聴覚系 
III. 嗅覚系",Iのみ,IIのみ,IIIのみ,IとIIIのみ,D
超高強度運動後のホスホクレアチンの完全な再合成に通常かかる時間を以下から選択せよ。,約10秒,約30秒,約1分,約4分,D
8台のバスを連続ジャンプさせようとするレースカーが、端にスロープのある平坦なコースに設置されている。このプロジェクトを担当するエンジニアは、バスをジャンプさせるためには、車が時速130kmに達する必要があると判断した。コースの距離を50mとすると、この速度に到達するためには、車はどのくらいの速度で加速しなければならないか?,13 m/s^2,26 m/s^2,7 m/s^2,17 m/s^2,A
脂肪酸がミトコンドリアに輸送される際、結合するものを以下から選択せよ。,チオキナーゼ,コエンザイムA (CoA),アセチル-CoA,カルニチン,D
"「サウナ入浴」と呼ばれることもあるサウナの利用は、極度の熱に短期間受動的にさらされることが特徴である。この熱にさらされることによって、軽度の高体温-深部体温の上昇-を引き起こし、神経内分泌、心血管系、細胞保護機構を含む体温調節反応を誘発し、ホメオスタシスを回復させ、将来の熱ストレス要因に備えて身体を整える...ここ数十年、サウナ入浴は、観察研究、介入研究、機構論的研究から得られた説得力のあるデータに基づき、寿命を延ばし、全身の健康を改善する手段として浮上してきた。特に興味深いのは、クオピオ虚血性心疾患危険因子 (KIHD) 研究の参加者を対象とした研究結果である。これは、フィンランド東部の中年男性2,300人以上を対象とした健康アウトカムに関する現在進行中の前向き集団ベースコホート研究で、サウナ利用と死亡や疾病の減少との間に強い関連性があることが確認されている...KIHDの結果は、週に2～3回サウナを利用した男性は、サウナを利用しなかった男性より心疾患関連要因による死亡が27％少なかったことを示した。[2]さらに、彼らが経験した恩恵は用量依存的であることが判明した：サウナを約2倍の頻度、週に約4～7回利用した男性は、約2倍の恩恵を受け、心疾患関連要因による死亡が50%低かった。[2]さらに、サウナを頻繁に利用する人は、すべての早死の原因による死亡率が40％低いことがわかった。これらの結果は、男性の健康に影響を及ぼす可能性のある年齢、活動レベル、ライフスタイルの要因を考慮しても同様であった。[2]...KIHDはまた、サウナを頻繁に利用することで、認知症やアルツハイマー病の発症リスクが用量依存的に低下することも明らかにした。週に2～3回サウナを利用する男性は、週に1回しかサウナを利用しない男性に比べて、認知症の発症リスクが66％、アルツハイマー病の発症リスクが65％低かった...サウナ利用に関連する健康上の利点は、精神的健康の他の側面にも及んだ。KIHD研究に参加した男性のうち、週に4～7回サウナを利用した男性は、食生活、社会経済的状況、身体活動、炎症状態 (C反応性タンパク質で測定) にかかわらず、精神病性障害を発症する可能性が77％低かった...高温にさらされると身体にストレスがかかり、迅速で強固な反応が引き起こされる。皮膚と深部の体温が著しく上昇し、発汗が起こる。まず皮膚が熱くなり、40℃ (104°F) まで上昇し、次に深部体温の変化が起こり、37℃ (98.6°F、平熱) から38℃ (100.4°F) までゆっくりと上昇し、その後39℃ (102.2°F) まで急速に上昇する...心拍数 (1分間の拍動数) は増加し、一回拍出量 (血液を送り出す量) は変化しないが、心拍出量 (酸素を必要とする身体に応じて心臓が行う仕事量の指標) は60～70％増加する。[5]この間、身体の血流の約50～70％は、発汗を促進するために、深部から皮膚に再分配される。平均的な人は、サウナ入浴中に約0.5kgの汗をかく。[11]急性熱曝露はまた、中核血液量の減少を緩和するために、血漿量全体の一過性の増加を引き起こす。この血漿量の増加は、発汗のための予備的な水分源となるだけでなく、自動車のラジエーターの水のような役割も果たし、深部体温の急激な上昇を防ぐために身体を冷却し、暑さへの耐性を促進する...サウナの利用を繰り返すことで、身体が暑さに順応し、将来の暴露に対する身体の反応が最適化されるが、これはおそらくホルミシス (ストレス要因の大きさに不相応な軽度のストレス要因にさらされた後の代償性の防御反応) として知られる生物学的現象によるものである。ホルミシスは、細胞の損傷を修復するだけでなく、その後のより破壊的なストレス要因への暴露から身を守るための、膨大な数の防御メカニズムを引き起こす...サウナ利用による生理学的反応は、中程度から強度の運動中に経験するものと驚くほどよく似ている。実際、サウナの利用は、慢性疾患や身体的制限のために運動ができない人のための運動の代替手段として提案されている。[13]

この論文に基づくと、著者が同意しそうな記述は次のうちどれか?",トレッドミルで走ることができない心臓手術患者は、サウナの利用が有益。,食事療法中の患者はサウナ利用が有益。,高血圧患者にとって塩分制限はサウナ利用と同等。,皮膚疾患のある患者は、サウナ利用で治癒する可能性がある。,A
ジイソプロピルフルオロリン酸 (DFP) は、ニューロンのシナプスにあるアセチルコリンエステラーゼ (ACE) の活性部位に結合する。DFPがACEに結合すると、ACE酵素は永久に不活性化する。このためDFPは強力な毒素となり、致死量は100mg未満である。DFPとACEの相互作用はどのように特徴づけられるか?,競合阻害,非競合阻害,不可逆的阻害,部分的競合阻害,C
翻訳の過程にはどの存在が必要か?,mRNA、tRNA、リボソーム,mRNA、リボソーム、RNAポリメラーゼ,DNA、mRNA、RNAポリメラーゼ,クロマチン、DNA、アミノ酸,A
パフォーマンスを高める合成ステロイドは、ホルモンの構造に基づいているが、以下からそのホルモンを選択せよ。,テストステロン,コルチゾール,プロゲステロン,アルドステロン,A
過塩素酸 (HClO4) は、現存する酸の中で最も強い酸のひとつと考えられている。次の記述のうち、強酸に最も正確に対応するものはどれか?,Kaは1より小さい,外側の価電子環に開いた電子スポットがある,安定な共役塩基を持つ,水の存在下でも結合したまま。,C
記述した量の2-ブロモブタンを強力なエタノール溶液に入れ、反応を完了させる。この反応の結果、2-ブテンの主生成物と1-ブテンの副生成物が生じる。出発化合物に関する次の記述のうち、2-ブテンが主生成物である理由を説明するものはどれか?,炭素3の水素原子が少ない,1-ブテンは溶液中で2-ブテンに転位する,エタノールは鎖の2番目の炭素を好む,環状芳香族化,A
手に負えない素行の快楽主義者のティーンエイジャーが、一晩のうちに、順次i) 妹と合意の上で性行為をし、ii) バーにチップを残さず、iii) 見知らぬ女性と合意の上でない性的関係を持ち、iv) 地元の教会のドアの階段で嘔吐した。このティーンエイジャーは、社会の規範を順次 (最大限に) 破っている。以下から順序を選択せよ。,道徳規範、道徳規範、法律、道徳規範,タブー、習俗、法律、タブー,法律、習俗、習俗、習俗,タブー、習俗、法律、道徳規範,D
最大持続可能出力について正しい記述を以下から選択せよ。,通常、レース中は一定。,人種の距離とともに減少する。,高脂肪食によって改善される。,筋グリコーゲン含有量と反比例する。,B
ある患者が非常に興奮した様子でERにやってきた。攻撃的な行動をとり、薬がないと「悪いことが起こる」と主張している。この患者のドーパミン系はどのような状態にあると考えられるか?,シナプス間隙のドーパミンが減少している。,シナプス後膜のドーパミン受容体が減少している。,ドーパミン細胞の多い領域で細胞死がみられる。,ドーパミンの脳領域で発作様の活動がある。,B
補聴器の実験を行っている科学者が、遺伝子組み換えで聴力を失ったマウス30匹に最新技術を装着し、ベルの音が聞こえたらレバーを押すという実験を行った。出力のレベルはさまざまに設定された。80％の出力では、20匹のマウスがレバーを押した。70％の出力では、15匹のマウスがレバーを押した。60％の出力では、10匹のマウスがレバーを押した。ベルが発するデシベルを聞き取るための絶対閾値に相当する出力レベルは次のうちどれか?,80%,70%,60%,十分な情報が与えられていない。,B
DNAからメッセンジャーRNA分子への転写が起きる場所を以下から選択せよ。,リボソーム上,細胞質,核内,細胞分裂時のみ,C
2つの反応物質を用いて未知の生成物の合成に関与する新しい酵素がトランスジェニックマウスから発見された。放射性標識化合物を用いてこの酵素を調べたところ、この酵素は一方の反応物質上の窒素基を他方の反応物質に切り替える過程を触媒することがわかった。この新しい酵素は次のどのカテゴリーに入るか?,酸化還元酵素,転移酵素,ヒドロラーゼ,リアーゼ,B
非常に弱い塩基の場合、溶液のpKbはどのようになることが予想されるか?,pOHと等しい,pOHより高い,pOHより低い,25℃で7に近い,B
ゲノムについて正しい記述はどれか?,ある生物の体細胞に見られる染色体の数。,ある生物の全DNA配列。,ある生物が生産できるタンパク質の全リスト。,染色体全体のDNA配列。,B
"ステロイド系分子は次のうちどれか? 
I. テストステロン 
II. トリグリセリド 
III. プロゲステロン 
IV. DNA",Iのみ,I、II、III,IとIII,I、III、IV,C
遊離脂肪酸のほとんどは血液中に輸送されるが、その際の状態として正しいものはどれか?,赤血球の中で輸送される。,リポタンパク質として輸送される。,グルコースと結合する。,アルブミンと結合する。,D
酵素活性に影響を与える要因は次のうちどれか?,温度,pH,特定の金属イオンの存在,上記のすべて,D
生きている細胞は、生存に必要な物質を得るため、また老廃物を排出するために、外部環境との絶え間ない相互作用を必要とする。次のプロセスのうち、物質が細胞膜を横切って移動する方向を制御するために、物質の勾配のみを利用するものはどれか?,浸透,受動輸送,能動輸送,エンドサイトーシス,A
ミトコンドリアの内膜に埋め込まれているものは以下の内どれか?,トリカルボン酸回路 (クレブス回路) の酵素,電子伝達系の構成要素,グリコーゲン分子,トリアシルグリセロール分子,B
実験用マウスのDNA断片は5' - GGATCCTCATG - 3'と決定された。この元のDNA配列が点突然変異と欠失の両方を経験した結果、次のDNA断片のどれになるか?,5' - GCATCCTCATG - 3',5' - TGATCCCAG - 3',5' - GGTCCTCATC - 3',5' - GGATCCATG - 3',C
アクション映画のあるシーンに取り組んでいたところ、音響技師は銃声の周波数を通常の音速をより正確に反映するように変更する仕事を与えられた。銃声は時速108kmで走行する車内の俳優から発せられ、200m離れた同じ方向に時速72kmで走行するプラットフォームに設置されたカメラによって記録された。銃声の周波数が通常800Hzである場合、カメラが銃声を拾う感知された周波数は何Hzか?,941Hz,787Hz,924Hz,912Hz,C
ある物体が平面に乗っている。このとき、物体と平面の間は、傾斜角θ、重力加速度g、摩擦係数µである。物体の加速度を与えるものは次のうちどれか?,a = g sin θ,a = g (sin θ - cos θ),a = g (cos θ - µ sin θ),a = g (sin θ - µ cos θ),D
デイビッドは全国レベルのチェリストであり、最近、オーケストラで演奏するために主要大学の奨学金を受けた。夏の間、彼は秋学期までに習熟するよう楽譜を渡された。デイビッドは自分の技術に関しては完璧主義者だ。いつももっと上手な奏者と自分を比較し、自分の曲のあるセクションをマスターできないと、自分にとても厳しくなる。次の答えのうち、デイビッドを最もよく表しているものはどれか?,自尊心が低い、自己効力感が強い、内的統制の場,自尊心が高い、自己効力感が強い、内的統制の場,自尊心が低い、自己効力感が強い、外的統制の場,自尊心が低い、自己効力感が低い、内的統制の場,A
ヒトによくみられる心臓の欠陥に心室中隔欠損症があるが、これは右心室と左心室の間の中隔に穴があいているものである。患者にこの欠陥がある場合、次の記述のうち正しいものはどれか?,左心房の酸素の割合が低くなる。,右心室の二酸化炭素の割合が高くなる。,右心房の酸素の割合が低くなる。,右心室の酸素の割合が高くなる。,D
MCATの試験準備をするとき、学生は電気化学細胞の勉強を始める。酸化還元反応について学んだ以前の情報と積極的に関連付けることによって、必要な基本情報を学ぶ。そして、それから知識を構築し、必要な高度な概念を学んでいく。この生徒のプロセスが最も特徴づけられているものを以下から選択せよ。,チャンキング,ネットワークモデル,維持リハーサル,詳細リハーサル,D
進化論に関する会議で、3日目に2人の科学者が壇上に上がり、互いの理論を論破し合った。それぞれが自分の哲学を熱心に学んでいる。最初の科学者は、生物はその時代に最も使われた器官を増やすことで進化したと主張する。そしてその器官を次の世代に受け継がせる。しかし二人目の科学者は、それぞれの生物が持つ利点は長い間存在せず、ランダムに発生し、それが有益であった場合、その生物は進化論的に言えば短期間で急速に個体数を増やすと考えた。次の記述のうち、2番目の科学者の主張を強めるものはどれか?,ボディビルダーはトレーニング量が多いほど子供が大きくなることを示す研究。,長期間の成長の停滞と、それに続く短期間の大規模な進化を示す分類学的研究。,生涯をかけて学んだことを子供に伝えることで、より成功した種を示した研究。,それぞれの新しい種が出現する間の時間が一定であることを示した研究。,B
ある音源が、ある速度、強度、周波数、波長で、ある音を、ある媒質から放出する。音が最初の媒質から出て、より密度の高い媒質に入っても変化しないものは次のうちどれか?,速度,強さ,周波数,波長,C
細胞のエネルギー電荷について正しい記述を以下から選択せよ。,細胞の外側と内側の電荷の差。,ナトリウム-カリウムATPアーゼによって生成される。,細胞による全体的なエネルギー使用率。,全アデニンヌクレオチドプールがリン酸化される程度。,D
身体が環境温度の上昇を補う方法は以下の内どれか?,塩分保持量の減少,呼吸数の増加,心拍数の増加,皮膚から失われる水分の増加,D
次のうち、体内で完全に酸化されたときに最もエネルギーを放出するのはどれか?,グルコース1グラム,パルミチン酸1グラム,ロイシン1グラム,アルコール1グラム,B
ある個体が、胎児期のヘモグロビンを成人期まで部分的に保持する突然変異を持って生まれた。正常な個体と比較した場合の、この個体が示す症状は以下の内どれか?,正常な成人と変わらない。,肺での酸素結合が著しく低下する。,胎児ヘモグロビンの保持は致命的であるため、症状はない。,組織中のヘモグロビンへの酸素結合が増加する。,D
女子の世界記録は主に以下の理由により近年急速に向上しているのはなぜか?,女性の筋肉量が増加したから。,女性が男性よりも速く走れるようになったから。,女性がより早い年齢からトレーニングを始めたから。,より多くの女性がスポーツに携わるようになったから。,D
筋収縮中、ミオシンとアクチンの相互作用により、各サルコメアの短縮が可能になる。パワーストロークの他に、筋収縮の他のプロセスでATPを必要とするものはどれか?,トロポミオシン-トロポニン相互作用,ミオシン-アクチン相互作用,カルシウム-トロポニン相互作用,ミオシン-アクチン剥離,D
クレアチンキナーゼの活性について以下から選択せよ。,細胞内ADPが上昇すると増加する。,筋pHが6.9を下回ると増加する。,II型線維ではI型線維よりも常に低い。,持久的トレーニングの後に増加する。,A
ある教師が小学校の生徒たちにご褒美制度を設けている。各日の終わりに、その日の朝、時間通りに登校した生徒にシールを一枚ずつ渡す。毎週末には、小テストで3回続けて90％以上の成績を取った生徒にシールを1枚ずつ渡す。この方法を数カ月続けた後、小テストの成績は著しく向上したが、遅刻はわずかに減少しただけであることがわかった。この教師の観察結果を説明するのに最も適切なものは次のうちどれか?,変数比率のスケジュールは、最も強い反応と、最も消滅の影響を受けにくい行動を生み出す。,生徒は時間通りに来ることよりも、小テストで良い結果を出すことに内発的動機づけを持っていた。,生徒の行動変化は連続強化スケジュールよりも固定比率スケジュールに対する方が強かった。,生徒の行動変化は可変間隔スケジュールよりも固定比率スケジュールの方が強かった。,C
解糖系における基質準位リン酸化を介したATPの純生産量を以下から選択せよ。,2はグルコースから、3はグリコーゲンから。,2はグルコースから、4はグリコーゲンから。,3はグルコースから、4はグリコーゲンから。,3はグルコースから、2はグリコーゲンから。,A
妊娠検査薬は非常に感度が高く、尿中のB-hCG、すなわちヒト絨毛性ゴナドトロピンの濃度を検出することで機能する。このホルモンはどのような組織から分泌され、どのような働きをしているか?,黄体、自己維持,子宮内膜、細胞分裂,胚盤胞、血流増加,胚盤胞、黄体維持,D
レンガ職人の息子が大学に進学し、i) 医学部で教師になり、ii) 終身教授に昇進し、iii) 別の学校で新たな終身教授の職を得るために国を移動する。この男性は順次どのような経験をしたか?,父親に対する世代間移動、水平移動、水平移動,息子に対する世代間移動、上昇移動、上昇移動,父親に対する世代間移動、上昇移動、水平移動,息子に対する世代間移動、水平移動、上昇移動,C
DNAポリメラーゼは、元の二本鎖DNAの鋳型鎖に相補的なヌクレオチドを付加することによって、新しいDNAを合成する。鋳型鎖の一部分のA:T塩基の比率が3:2であった場合、新しく合成された相補鎖DNAのA:Tの比率は?,3:02,1:01,2:03,決定できない。,C
トリカルボン酸回路 (クレブス回路) が1回転する間に、何個のCO2とATP分子が生成されるか?,2CO2と2ATP,2CO2と16ATP,2CO2と12ATP,2CO2と1ATP,D
ある幼い子どもが、家庭環境の評価のために心理学者のところに連れてこられる。子どもはフロアの真ん中に置かれ、片方に母親、もう片方に心理学者がいる。その後、母親はしばらくその場を離れ、また戻ってくる。この評価で問題となる徴候は次のうちどれか?,母親が部屋を出ているときの探索の減少。,戻ってくると泣きながら母親のもとに戻る。,戻ってくると母親を避ける。,母親が部屋を出る前に部屋を探索する。,C
激情に駆られた政治討論の観衆が、「生活保護受給者はみんな怠け者だ」と叫んだ。この観衆の思考回路の例は以下の内どれか?,偏見,差別,自民族中心主義,コンフリクト理論,A
新生児呼吸窮迫症候群 (NRDS) は、肺胞膜を介した酸素拡散を促進する能力が低下した未熟児にみられる重篤な合併症である。これは、界面活性物質の産生が不十分であることが原因である。酸素拡散を促進する上で、界面活性物質はどのような役割を果たすか?,肺表面の透過性を高める,肺胞を開いた状態に保つ,肺繊毛を抑制する,血管を拡張する,B
"この式を用いて、84gのエタンと無制限の酸素を反応させた場合、何gの二酸化炭素が生じるか? (炭素原子量: 12amu、水素原子量: 1amu、酸素原子量: 16amu) 
﻿
エタンガスから二酸化炭素と水への不均衡反応は次のようになる: 
﻿
 C2H4 + O2 -> CO2 + H2O",78g,528g,264g,156g,C
