深夜の通りを歩いていた成人男性が、地面に倒れて動かない若い女性に気づく。女性は通りの反対側にいる。通りを渡った歩行者は、その若い女性が自分よりずっと裕福そうで、異なる民族であることに気づく。他に誰もいないのを見て、歩行者は助けを求めた。バイスタンダー効果によると、歩行者の反応が変わるのは次のうちどれか?,援助を必要としている人が、社会経済的に高い階層ではなく、低い階層に見えること,通りの1ブロック先に別のグループがいること,援助を必要としている人が、異なる民族ではなく、同じ民族に見えること,すでにその少女に近づいている他の人が1人いること,D
"「サウナ入浴」と呼ばれることもあるサウナの利用は、極度の熱に短期間受動的にさらされることが特徴である。この熱にさらされることによって、軽度の高体温-深部体温の上昇-を引き起こし、神経内分泌、心血管系、細胞保護機構を含む体温調節反応を誘発し、ホメオスタシスを回復させ、将来の熱ストレス要因に備えて身体を整える...ここ数十年、サウナ入浴は、観察研究、介入研究、機構論的研究から得られた説得力のあるデータに基づき、寿命を延ばし、全身の健康を改善する手段として浮上してきた。特に興味深いのは、クオピオ虚血性心疾患危険因子 (KIHD) 研究の参加者を対象とした研究結果である。これは、フィンランド東部の中年男性2,300人以上を対象とした健康アウトカムに関する現在進行中の前向き集団ベースコホート研究で、サウナ利用と死亡や疾病の減少との間に強い関連性があることが確認されている...KIHDの結果は、週に2～3回サウナを利用した男性は、サウナを利用しなかった男性より心疾患関連要因による死亡が27％少なかったことを示した。[2]さらに、彼らが経験した恩恵は用量依存的であることが判明した：サウナを約2倍の頻度、週に約4～7回利用した男性は、約2倍の恩恵を受け、心疾患関連要因による死亡が50%低かった。[2]さらに、サウナを頻繁に利用する人は、すべての早死の原因による死亡率が40％低いことがわかった。これらの結果は、男性の健康に影響を及ぼす可能性のある年齢、活動レベル、ライフスタイルの要因を考慮しても同様であった。[2]...KIHDはまた、サウナを頻繁に利用することで、認知症やアルツハイマー病の発症リスクが用量依存的に低下することも明らかにした。週に2～3回サウナを利用する男性は、週に1回しかサウナを利用しない男性に比べて、認知症の発症リスクが66％、アルツハイマー病の発症リスクが65％低かった...サウナ利用に関連する健康上の利点は、精神的健康の他の側面にも及んだ。KIHD研究に参加した男性のうち、週に4～7回サウナを利用した男性は、食生活、社会経済的状況、身体活動、炎症状態 (C反応性タンパク質で測定) にかかわらず、精神病性障害を発症する可能性が77％低かった...高温にさらされると身体にストレスがかかり、迅速で強固な反応が引き起こされる。皮膚と深部の体温が著しく上昇し、発汗が起こる。まず皮膚が熱くなり、40℃ (104°F) まで上昇し、次に深部体温の変化が起こり、37℃ (98.6°F、平熱) から38℃ (100.4°F) までゆっくりと上昇し、その後39℃ (102.2°F) まで急速に上昇する...心拍数 (1分間の拍動数) は増加し、一回拍出量 (血液を送り出す量) は変化しないが、心拍出量 (酸素を必要とする身体に応じて心臓が行う仕事量の指標) は60～70％増加する。[5]この間、身体の血流の約50～70％は、発汗を促進するために、深部から皮膚に再分配される。平均的な人は、サウナ入浴中に約0.5kgの汗をかく。[11]急性熱曝露はまた、中核血液量の減少を緩和するために、血漿量全体の一過性の増加を引き起こす。この血漿量の増加は、発汗のための予備的な水分源となるだけでなく、自動車のラジエーターの水のような役割も果たし、深部体温の急激な上昇を防ぐために身体を冷却し、暑さへの耐性を促進する...サウナの利用を繰り返すことで、身体が暑さに順応し、将来の暴露に対する身体の反応が最適化されるが、これはおそらくホルミシス (ストレス要因の大きさに不相応な軽度のストレス要因にさらされた後の代償性の防御反応) として知られる生物学的現象によるものである。ホルミシスは、細胞の損傷を修復するだけでなく、その後のより破壊的なストレス要因への暴露から身を守るための、膨大な数の防御メカニズムを引き起こす...サウナ利用による生理学的反応は、中程度から強度の運動中に経験するものと驚くほどよく似ている。実際、サウナの利用は、慢性疾患や身体的制限のために運動ができない人のための、運動の代替手段として提案されている。[13]

次のうち、記事のこの抜粋に続く段落として考えられるものはどれか?",熱に反応して細胞内機能を促進するタンパク質に関する段落。,エスキモーの集団における心臓発作の増加に関する段落。,フィンランドの水球チームの卓越性についての総括。,高レベルの熱にさらされたラットに関する研究。,A
筋の乳酸産生が増加するのはいつか?,酸素が容易に利用できるとき。,グルコースの分解からピルビン酸が生成されないとき。,筋のpHが低下するとき。,運動開始時に解糖が活性化されるとき。,D
トリアシルグリセリドは、I. リボース骨格 II. グリセロール骨格 III. 3つのホスホジエステル結合 IV. 3つのエステル結合のうち、どれからなるか?,IとIII,IIのみ,IIとIII,IIとIV,D
非競合的阻害が不競合阻害と異なる点は、非競合的阻害剤が酵素上のアロステリック部位に結合して反応への触媒となることを阻害するのに対し、不競合阻害剤は酵素基質複合体に結合して触媒反応を阻害する点である。基質濃度を上げると、次のどのような効果があるか?,不競合阻害剤の影響を増加させ、非競合的阻害剤の濃度を減少させる,不競合阻害剤の影響を減少させ、非競合的阻害剤の影響を増加させる。,不競合阻害剤の影響を増加させる,効果なし,C
タイラーはエンジニアを目指している高校生。2年生の微積分Ⅱの授業で、彼は最初のテストでFを取る。この出来事に対する次の反応のうち、タイラーがその後の試験で成績が向上する可能性が高いのはどれか?,最初のテストはいつも他のテストより難しいと判断する。,先生がタイラーを嫌いだから、試験の採点を厳しくしたのだと言う。,次の試験中にはない家庭環境のせいだと言う。,自分の勉強法を批判し、どの点が成績不振につながったかを探ろうとする。,A
神経細胞では、微小管結合タンパク質 (MAP)、特にMAP2とMAPタウが微小管を安定化させるために働いている。マウスモデルにおいて、MAPの全ファミリーの機能を大幅に低下させ、微小管の分解を増加させる変異体が開発された。最も影響を受けそうな細胞活動はどれか?,心筋収縮,DNAからのmRNAの転写,クレブス回路,減数分裂,D
骨格筋の収縮プロセスを開始する引き金となるものは以下のどれか?,ミオシンへのカリウムの結合。,カルシウムのトロポミオシンへの結合。,ミオシンクロスブリッジへのATP結合。,トロポニンへのカルシウム結合。,D
筋肉細胞の筋小胞体はどのような働きをするか?,消化酵素の貯蔵。,ナトリウムイオンの貯蔵,脂質の貯蔵。,カルシウムイオンの貯蔵。,D
薬理学的薬剤による脳内神経伝達物質の変化が、疲労の発現に影響することが示されているのはどれか?,アセチルコリンとノルアドレナリン,ドーパミンとアセチルコリン,グルタミン酸とセロトニン,ドーパミンとセロトニン,D
酸素が使われるものを以下から選択せよ。,解糖。,脂肪酸からアセチルCoAへの変換。,トリカルボン酸回路 (クレブス回路)。,グリコーゲン分解。,B
突然変異はどのようなDNAのエラーか?,常に有害である。,発癌物質の存在下でのみ起こる。,腫瘍の増殖を増加させる。,自然発生する割合は低い。,D
解糖の酵素がある場所はどこか?,ミトコンドリア,核,細胞質,リソソーム,C
合理的選択理論は、行動は個人の利益に基づいて選択されるという概念を前提としている。合理的理論の3大前提は、完全性、推移性、変数の独立性である。これはどのようなシステムとして最も正確に表現されるか?,階層的,家父長制,女家長制,寡頭制,A
複数のスプリントスポーツ中に血中濃度が上昇するADP分解産物はどれか?,アンモニア、ヒポキサンチン、尿酸。,アンモニア、尿素、尿酸。,アンモニア、尿素、クレアチニン。,アンモニア、尿素、クレアチン。,A
解糖の律速酵素を以下から選択せよ。,ホスホリラーゼ。,ヘキソキナーゼ。,ピルビン酸デヒドロゲナーゼ。,ホスホフルクトキナーゼ。,D
高強度運動における疲労の基本的な原因は何か?,細胞内のADP濃度の低下。,ATP産生の抑制。,ATP供給が需要に追いつかないこと。,技術不足。,C
血中乳酸蓄積速度が決定されるものを以下から選択せよ。,筋乳酸産生速度および筋乳酸排出速度。,嫌気的解糖速度。,筋グルコースの取り込み速度。,乳酸出現速度と乳酸クリアランス速度の差。,D
I型筋線維にある特徴は以下のうちどれか?,白色、解糖性、収縮が遅い。,白色、酸化的、収縮が遅い。,赤色、酸化的、収縮が速い。,赤色、酸化的、収縮が遅い。,D
ある気体が200atmで0.1Lを占めるとすると、1atmでの体積はどれか?,20Lよりわずかに少ない,20L,20Lよりわずかに多い,2000L,A
ヒトの循環系がベルヌーイの流体力学の原理に従うと仮定した場合、首の毛細血管と右膝の断面積が等しい毛細血管における血圧を最も正確に比較しているのはどの記述か?,首の圧力は、圧力水頭が増加するため、膝の圧力より大きい,首の圧力は、連続方程式に従った等しい動圧のため、膝の圧力と等しい,膝の圧力は、圧力水頭が増加するため、首の圧力より大きい,流体の密度と粘度の知識がなければ、正確な比較はできない,C
炭酸水素ナトリウムの摂取は、どのようにして中距離走のパフォーマンスを向上させるか?,細胞外液のpHと緩衝能が上昇させ、筋肉からの水素イオンの流出が速くなる。,細胞外液のpHと緩衝能が低下させ、筋肉からの水素イオンの流出が速くなる。,細胞外液のpHと緩衝能を上昇させ、筋肉への水素イオンの流入を促進する。,運動前の筋pHを上昇させる。,A
ある個人が初期評価とケア確立のためにクリニックを受診する。患者は46歳、XYとして生まれたが、女性であると自認している。彼女の好む代名詞は、彼女は/彼女のである。また、性行為の相手は女性のみである。この人物の性別と指向を表すとしたらどれか?,シスジェンダー、異性愛者,トランスジェンダー、異性愛者,シスジェンダー、同性愛者,トランスジェンダー、同性愛者,D
解糖速度が速いときにpHの変化を抑える細胞内緩衝液として働くものは次のうちどれか?,グルタミン,グルコース,カルノシン,アミラーゼ,C
飛行機を滑走路に誘導するための信号灯を建設している技術者チームが、パイロットが1マイル先の管制塔を検知するのに必要な明るさを決定しようとしている。彼らはライトをテスト用の明るさに設定し、到着するパイロットとの通信を確立する。パイロットは管制塔から1マイル離れたところで、ライトが見えないと言う。信号検出理論の言葉では、これは何と呼ばれるか?,ヒット,ミス,誤報,正しい拒否,B
ニューヨークには、さまざまなバックグラウンドを持つ700万人以上の人々が住んでいる。街自体にも特徴があるが、小さなエリアがいくつかあり、たいていは同じ国籍の人々が集まり、以前住んでいた国の習慣を守っている。たとえば、市内の小さな町リトル・イタリーでは、今でも頬にキスをして挨拶する習慣がある。これはどのような現象の一例か?,サブカルチャー,カウンターカルチャー,マイクロカルチャー,カルチャーラグ,A
補欠基について以下から選択せよ。,細胞内のすべての酵素に必要。,水素結合を介して酵素に緩く結合している。,酵素活性のアロステリックな修飾を可能にする酵素分子上の部位。,酵素に強固に結合し、その活性に必要。,D
コドンは何から成るか?,mRNAまたはDNA中のヌクレオチド塩基の三重鎖配列。,mRNAまたはDNA中のヌクレオチド塩基の四重鎖配列。,ポリペプチド鎖中のアミノ酸の三重鎖配列。,DNA中のデオキシリボース糖の三重鎖配列。,A
サッカーのような競技での、血中乳酸濃度について正しいものを以下から選択せよ。,3mM以上に上昇することはほとんどない。,通常、前半終了時よりも試合終了時の方が低い。,通常、前半終了時よりも試合終了時の方が高い。,試合中、選手の疲労が増すにつれて増加する。,B
ニューロンの機能に関して、正しくないものを選択せよ。,活動電位の終末における過分極は、ニューロンが活動電位の発火速度を制限するメカニズムの一つである。,ナトリウムのニューロンへの流入は、活動電位の最初の段階で膜を脱分極させる。,伝達ニューロンは、樹状突起からシナプス間隙に神経伝達物質を分泌する。,活動電位は、軸索小丘が閾電位に達したときに開始される。,C
次のうち正しいのはどれか?,タンパク質摂取量を1日あたり体重1kgあたり3g以上に増やすと、筋肉の成長が刺激され、筋力が増加する。,クレアチンのサプリメントは筋力とパワーを増加させる。,アミノ酸サプリメントは筋力とパワーを増加させる。,筋損傷は短縮性収縮によって誘発される。,B
次の記述のうち、誤っているのはどれか?,アンモニアは高強度の運動を繰り返すと発生する。,筋乳酸の蓄積は、少なくとも5秒間の間欠的筋収縮が起こるまでは始まらない。,筋ホスホクレアチンの枯渇は、高強度運動の最初の数秒間で始まる。,繰り返しスプリントの回数が増えるにつれて、筋中の乳酸の蓄積速度は低下する。,B
運動中にATPを再合成する最も迅速な方法は?,解糖,ホスホクレアチンの分解。,トリカルボン酸回路 (クレブス回路)。,グリコーゲン分解,B
ミトコンドリア膜に埋め込まれた電子伝達鎖は、主に細胞が使用する新しいATP分子を生成するために存在する。これは、膜の外側に形成されたH+イオンが、ATP合成酵素として知られる特殊なチャネルを通過して戻ってくるという正の勾配によって達成される。これによって生じたエネルギーは、ATPを酸化的リン酸化として知られるATPにリン酸化する。H+がミトコンドリア内部に戻るメカニズムは何として知られているか?,受動輸送,受動拡散,能動輸送,エンドサイトーシス,A
細胞に酸素が供給されなくなると、最初に生成されなくなる分子は次のうちどれか?,オキサロ酢酸,ピルビン酸,水,アデノシン三リン酸,C
"思春期を通じて薬物を乱用した結果、ある若年成人は実行機能の低下を反映する多くの心理的症状に苦しんでいる。この患者に当てはまる可能性が高いのは次のうちどれか? 
I. 前頭前野の病的変化。
II. 幻聴に対する感受性の増加。
III. 行動衝動制御の低下。",Iのみ,IIIのみ,IとIIIのみ,IIとIIIのみ,C
筋肉におけるグリコーゲンの分解が、最初に生成するものは?,グルコース。,グルコース-1-リン酸。,グルコース-6-リン酸。,"グルコース-1,6-二リン酸。",B
12月の試合に向けて減量しようとしているレスラーが、2カ月かけて30ポンド落とすことを約束する。次のうち、摂取カロリーを制限する方法として適切でないものはどれか?,コーヒーショップではなく、健康スムージーの店で勉強する。,毎週土曜日に、カロリー目標を達成した自分へのご褒美として、良い香りの食事をする。,カロリーの高いスナック菓子を食べたら、輪ゴムでパチンと打つ。,スナック菓子を家の中の見えないところに隠す。,D
SDS-PAGE法では、SDSが洗剤の役割を果たす。タンパク質を電気泳動ゲルに通す前に、なぜ洗剤で処理するのか?,タンパク質を大きなプラス電荷でコーティングするため。アミノ酸の側鎖はプラス、マイナス、ニュートラルの電荷を持つことがあり、ゲル中で良好な分離を得るためには大きな均一電荷が必要だから。,一次配列の長さにのみ基づいてタンパク質を電気泳動で分離できるようにするため。,電気泳動でタンパク質を三次構造に基づいて正確に分離できるよう、タンパク質の変性を防ぐため。,タンパク質の三次構造と一次構造をともに有する分子内結合を切断することにより、大きさで選別できる線状の断片を生成するため。,B
1～2秒持続する非常に強い収縮の場合、最初のエネルギー源となるものは以下のうちどれか?,解糖。,クレアチンリン酸化。,ホスホクレアチン貯蔵。,ATP貯蔵。,D
スポーツにおける成功に影響を与えない要因は次のうちどれか?,病気や怪我に屈することなく、激しいトレーニングに耐える能力。,戦術。,食生活。,運動中のカルニチンの摂取。,D
消化管と呼吸管の内層は、どの胚葉から発達するか? I. 内胚葉 II.中胚葉 III.外胚葉,Iのみ,IIのみ,IIIのみ,IとII,A
実験室で単離された膜貫通タンパク質は、量の異なる4種類のアミノ酸で構成されていることがわかった。それらは多い順に、グリシン、チロシン、アルギニン、イソロイシンである。これらのアミノ酸のうち、膜貫通ドメインの内側にある可能性が最も高いのはどれか?,グリシン,チロシン,アルギニン,イソロイシン,D
次のヌクレオチド塩基のうち、RNAに存在しないものはどれか?,チミン,アデニン,ウラシル,グアニン,A
速筋線維に含まれるものは以下のうちどれか?,比較的数が多いミトコンドリアと、低いATPアーゼ活性。,比較的数が少ないミトコンドリアと、低いATPアーゼ活性。,比較的数が少ないミトコンドリアと、高いATPアーゼ活性。,比較的数が多いミトコンドリアと、高いATPアーゼ活性。,C
1分子のグルコースから2分子のピルビン酸への変換が、正味で生成するものは以下のうちどれか?,6分子の水。,2分子のATP。,3分子のATP。,38分子のATP。,B
急性骨髄性白血病は、骨髄前駆細胞が急速に分裂し、半幹細胞の状態を保つ悪性癌である。正常の状況下で、この幹細胞から生じる細胞型は次のうちどれか?,NK細胞,血小板,T細胞,リンパ球前駆細胞,B
乳酸と水素イオンはどのように筋肉から出るか?,カルノシンとの共輸送機構を介して。,活性輸送機構を介して。,タンパク質トランスポーター分子を介して。,単純な拡散によって。,C
"細胞が正しく分裂するためには、正しく遂行されなければならない有糸分裂の5つの段階がある。有糸分裂の段階を、その適切な構成要素に当てはめよ。
分裂前期-核小体の溶解",分裂中期-2つの異なる核膜の形成,細胞質分裂-姉妹染色分体がそれぞれの極に分離,分裂終期-赤道板の形成,分裂後期-細胞質と小器官の分離,A
ある研究では、非常に選択的な大学への入学について調査した。入学受理の相関を調べたところ、入学と強く相関していた2つの明らかな因子はGPAと標準化されたテストスコアであり、相関値はそれぞれ+0.41と+0.55であった。しかし、この研究では、選択的な大学の卒業生ネットワークと重複するソーシャルネットワークを持つ学生は、入学する可能性がさらに高く、ソーシャルネットワークと卒業生ネットワークの間の相関は+0.61であることも示された。この相関が示していることは以下のうちどれか?,文化資本の価値。,実力主義。,社会資本の価値。,誤った連想。,C
ある患者は、彼が述べたところによると「狂っている」犬に噛まれて来院する。傷口は開いており、出血している。動物管理局が犬を捕獲したところ、口から泡を吹いており、非常に攻撃的であったという。狂犬病感染を疑い、患者には馬の体内で培養された狂犬病抗体を含む血清が投与される。これはどのような免疫の例か?,受動的,能動的,自然的,人工的,A
世界システム論では、世界を単位として、中核国、周辺国、半周辺国の3つのサブカテゴリーに分類している。次の答えのうち、半周辺国と最もよく相関するものはどれか?,中央政府が強い。,1つの天然資源に集中した経済。,経済が多様化し、発展している。,超上流階級の個人の割合が少ない。,C
キナーゼ反応について、正しいものを以下から選択せよ。,ATPの分解を阻害する。,リン酸基の付加または除去を伴う。,ケトン基の付加または除去を伴う。,ポリペプチド鎖へのアミノ酸の付加または除去を伴う。,B
筋肉から出て循環に入る乳酸の主な運命は以下のうちどれか?,肝臓で尿素に変換される。,心臓でグルコースに変換される。,腎臓を経由して排泄される。,他の組織により取り込まれ酸化される。,D
筋肉中のATP貯蔵量は、どれくらいの高強度の運動のエネルギーしか供給できないか?,2ミリ秒。,2秒。,10秒。,20秒,B
運動中の筋肉におけるグリコーゲンの分解は、何によって活性化されるか?,インスリン。,コルチゾール,pHの上昇。,上記のいずれでもない。,D
愛着理論によると、心理学的研究の過程で、次のうちどの子どもが、それまでその子どもが知らなかった男性心理学者に愛着を持つ可能性が最も高いか?,安全で安定した環境で育てられた生後2ヵ月の女性の乳児,安全で安定した環境で育てられた生後5ヵ月の男性の乳児,よく子どもを放置する1人の養育者に育てられた生後8ヵ月の男性の乳児,ときどき子どもを放置する2人の養育者に育てられた生後13ヵ月の女性の乳児,A
クレアチンは何から合成されるか?,筋肉中のアミノ酸。,肝臓のアミノ酸。,腎臓のアミノ酸。,腎臓のクレアチニン。,B
視床下部はCRFを放出することによって身体のストレス反応を制御し、最終的に身体のストレスホルモンであるコルチゾールを全身に放出させる。このトリガーは、最終的にどのメカニズムによって抑制されるか?,副腎への血流の収縮。,CRFの体内貯蔵量の枯渇。,コルチゾールの負のフィードバックループ。,CRF抑制因子の放出。,C
