ヘリウムを充填した風船の円周を、室温、温めたオーブン に30分間入れた後、冷凍庫に30分間入れた後の3つ の異なる条件で測定する。温度 T の関数として円周の3乗C^3をプロットする生徒は、次のうちどれを見いだすか?,C^3とTの間に三次の関係,C^3とTの間に間接的な関係,C^3がゼロになる温度Tの外挿,温度Tが上昇するにつれてC^3が最大になること,C
実験室で油滴の電荷を測定する。次の測定値のうち、正しい可能性が極めて低いとして却下されるべきものはどれか?,6.4×10^−19C,8.0×10^−19C,4.8×10^−19C,2.4×10^−19C,D
1.5×10^6m/sの初速で移動している陽子は、大きさ1.0Tの一定の磁場Bの領域に入る。陽子の初速度ベクトルがBの方向と30°の角度をなしている場合、磁場に入ってから4秒後の陽子の速度を計算しなさい。,5.0×10^5 m/s,7.5×10^5 m/s,1.5×10^6m/s,3.0×10^6 m/s,C
次のうちどの変化を回路に加えると、必ず電流が増加するか?,電圧を増加させ、抵抗を増加させる,電圧を減少させ、抵抗を減少させる,電圧を増加させ、抵抗を減少させる,電圧を減少させ、抵抗を増加させる,A
一様な円運動に関して正しいのはどれか?,遠心力は求心力の作用・反作用対。,求心加速度と速度は同じ方向を向いている。,運動している物体の速度は変化するが、物体の加速度は一定。,一様な円運動をしている衛星は、円軌道を描いて中心に向かって落下している。,D
ある実験用カートは、t1=0.10秒の時点で東に25 cm/sで移動し、その後、t2=0.20秒の時点で東に15cm/s移動していることがわかっている。これは、t1とt2の間にカートに作用する正味の力の方向を決定するのに十分な情報か?,はい。カートが減速していることがわかっているため、その運動量の変化は進行方向と反対であり、正味の力は運動量の変化の方向に働く。,いいえ。カートに摩擦や空気抵抗などの力が作用しているかどうかわからないため。,いいえ。カートの質量が分からないため。,はい。カートが東に動き続けていることが分かっているため、正味の力は運動方向にあるはず。,A
エレベーターが上昇している。エレベーターを引っ張っているケーブルの張力を求めるには、（エレベーターに関する）どの値が必要か?,質量、速度、高さ、加速度,質量、速度、加速度,質量、速度,質量、加速度,D
ゼロでない2つのベクトルを足し合わせ、その結果のベクトルがゼロである場合、その2つのベクトルには何が当てはまるか?,大きさが等しく、同じ方向を向いている。,大きさが等しく、反対方向を向いている。,大きさが異なり、反対方向を向いている。,0でない2つのベクトルの和が0になることはありえない。,B
陽子がソレノイドに入る。進入時、陽子はソレノイドの軸に沿って直線運動している。ソレノイド内でのプロトンの運動の説明として正しいものはどれか?,プロトンは放物線を描いて曲がる。,プロトンは円軌道を描いて曲がる。,プロトンは等速で直進を続ける。,プロトンは直進を続け、減速する。,C
周波数fの音波は空気中を速度vで伝わる。周波数4fの音波は空気中をどのような速度で伝わるか?,v/4,v,2v,4v,B
どのような条件下で、閉じた表面を通る正味の電束は、囲まれた電荷に比例するか?,どのような条件下でも,囲まれた電荷が対称的に分布しているときだけ,近接するすべての電荷が対称的に分布しているときだけ,表面の外側に電荷がないときだけ,A
空気中から窓ガラスに入ってきた単色光の光線は何が変化するか?,周波数と波長,速度と波長,速度のみ,波長のみ,B
理想気体について行われた実験でデータが収集された。実験では、温度(単位: K)が独立変数で、体積(単位: m^3)が従属変数である。従属変数が縦軸になるようにプロットした場合、グラフの傾きとy切片について正しいのはどれか?,傾きは気体の圧力に直線的に比例し、切片は0m^3になる。,傾きは気体の圧力に反比例し、切片は0m^3になる。,傾きは気体の圧力に直線的に比例し、切片は0m^3にならない。,傾きは気体の圧力に反比例し、切片は0m^3にならない。,B
おもちゃの車とおもちゃのトラックが衝突した。おもちゃのトラックの質量がおもちゃの車の質量の2倍である場合、トラックの加速度と比較して、衝突時の車の加速度はどうなるか?,2倍の大きさで同じ方向,2倍の大きさで反対方向,半分の大きさで同じ方向,半分の大きさで反対方向,B
質量の等しい球体、立方体、円柱が、短い傾斜の頂上から静止状態から解放される。傾斜の表面は非常に滑りやすく、放たれた物体は回転せず、むしろ無視できる程度の摩擦で滑るほどである。先に傾斜の底に到達するのはどれか?,球体,立方体,円柱,すべて同時に底面に到達する。,D
ある自動車が静止状態から出発し、15.0秒で最終速度20.0m/sまで一様に加速する。この時間内に自動車はどの程度の距離を移動したか?,150m,300m,450m,600m,A
理想的な発射体は、その水平変位（射程距離）がその最大垂直変位に等しくなるように、水平に対してどの角度で発射されるべきか?,sin−1 (1/g),cos−1 (1/g),45°,tan−1 4,D
大砲が5m/sで前進するトラックに取り付けられている。操縦者は大砲からボールを発射して、ボールが平らな面に当たる前にできるだけ遠くまで飛ぶようにしたい。大砲の銃口速度は50m/sである。操作者は大砲を水平からどの角度に向けるべきか?,5°,41°,45°,49°,D
2つの荷電した重い粒子は、粒子間の影響を除くすべての影響から隔離されている。それらは、それらの間の正味の力が0Nとなるような電荷と質量を有する。次のうち、正しくないものはどれか?,粒子は同じ符号の電荷をもたなければならない。,粒子間の距離が変化すると、力は0Nではなくなる。,粒子は同じ質量でなければならない。,2つの粒子間の正味の力が0になることはないため、このような状況は不可能。,A
水平に対して45°の角度で発射された理想的な発射体の運動に関する次の記述のうち、正しいものはどれか?,加速度ベクトルは、上りの速度ベクトルとは反対を向き、下りの速度ベクトルとは同じ方向を向く。,軌道の上端での速度はゼロ。,飛行中、物体の全速度は一定。,垂直速度は上昇するにつれて減少し、下降するにつれて増加する。,D
電荷を帯びた2つの球が短い距離で離れており、その間に50μNの力が生じている。それぞれのボールの電荷を同じにしたまま、一方のボールの質量を2倍にし、もう一方のボールの質量を2倍にしない。ボール間の新しい電気力はどうなるか?,50μN,100μN,200μN,400μN,A
移動中の1.5kgのカートが、最初は静止していた0.5kgのカートに衝突し、くっついた。衝突の直後、カートはそれぞれ互いに同じ______を持っている。,速度,運動エネルギー,質量,運動量,A
崖から落下した岩が30m/sの衝撃速度で地面に衝突した。崖の高さはどれか?,20m,30m,45m,60m,C
速度vで走っている車が角度θの傾斜のふもとに到達した。車はエンジンを使用せずに惰性で傾斜を進む。摩擦と空気抵抗を無視した場合、車の水平加速度axと垂直加速度ayの大きさについて正しいのはどれか?,ax=0; ay<g,ax=0; ay=g,ax<g; ay<g,ax<g; ay=g,C
平行平板コンデンサの静電容量を増加させるのは次のうちどれか?,より小さなプレートを使う,プレート間の誘電体材料を誘電率の小さいものに取り替える,プレート間の電圧を下げる,プレート同士を近づける,D
ある人が、回転している摩擦のないプラットホームの上に両手を横にして立っている。次のうち、人と台のシステムの角運動量を変化させうるものはどれか?,友人が投げた野球のボールを男性がキャッチする。,男性が両腕を体から離して突き出す。,男性が両腕を体から離して突き出し、すぐにまた両腕を体側に戻す。,空中に飛び上がり、プラットホームに着地する。,A
可動式ピストンを備えたシリンダーに、圧力P=1×10^5Pa、体積V=20cm^3、温度T=273Kの気体が入っている。このピストンが熱を気体から逃し、温度が一定に保たれるよう、ゆっくりとした一定の形で下向きに動く。気体の最終的な体積が5cm^3である場合、その結果生じる圧力はいくらか?,0.25×10^5Pa,2×10^5Pa,4×10^5Pa,8×10^5Pa,C
次の電磁波のうち、最も波長の長いものはどれか?,ガンマ線,紫外線,青色の光,オレンジ色の光,D
電気モーターには、次のようなラベルが貼られている。入力： AC120V、1.0アンペア、60Hz、効率75％。このモーターが6kgの質量を持ち上げることができる一定速度はどれか?,0.5m/s,1.0m/s,1.5m/s,2.0m/s,C
焦点距離f=0.2mの凸レンズを使って、テーブルの上に置かれた小さな硬貨を検査する。検査中、レンズは硬貨の上0.3mのところに置かれ、硬貨の上0.1mのところまでゆっくり移動する。この間、硬貨の像に何が起こるか?,コインの像が大きくなり続ける。,コインの像が小さくなり続ける。,像は、最初は小さく、次に大きくなる。,像が裏返る。,D
"スペースシャトルが地球の表面から300km上を回る。地球の半径は6,400kmである。スペースシャトルが受ける重力加速度はどれか?",ゼロ,4.9m/s^2,9.8m/s^2,8.9m/s^2,D
ある宇宙飛行士が、質量と半径がそれぞれ地球の2倍の惑星に着陸した。宇宙飛行士の体重が地球で800Nであった場合、この惑星では何Nになるか?,200N,400N,800N,1600N,B
質量100kgの人と質量50kgの人の2人が、氷で覆われた（実質的に摩擦のない）池の上に向かい合って立っている。重い方が軽い方を力Fで押した場合、どうなるか?,重い方が感じる力は(−1/2)F,その人が感じる力は−2F,軽い方の加速度の大きさは、重い方の加速度の大きさの半分,軽い方の加速度の大きさは、重い方の加速度の大きさの2倍,D
30mFのコンデンサは、各プレートに6ミリクーロンずつの電荷を持つ。コンデンサに蓄えられるエネルギーは、およそどのくらいか?,5.4×10−10J,9.0×10−8J,0.6J,12.5J,C
電池と抵抗の組み合わせで、電流が最も大きくなる回路はどれか?,抵抗を直列に配置した高電圧バッテリー,抵抗を並列に配置した高電圧バッテリー,抵抗を直列に配置した低電圧バッテリー,抵抗を並列に配置した低電圧バッテリー,A
ゴム製のボール（質量＝0.08kg）を3.2mの高さから落とし、床で跳ね返った後、ほぼ元の高さまで上昇させた。床との衝突時間が0.04秒と測定された場合、床がボールに与えた平均力はどれか?,0.16N,0.16N,0.32N,0.36N,C
同じ質量の球体とブロックの2つの物体が、傾斜面の頂上で静止状態から解放される。球体は滑ることなく傾斜面を転がり落ちる。ブロックは摩擦なしに傾斜面を滑り落ちる。どちらの物体が先に傾斜面の底に到達するか?,球体。球体は回転運動エネルギーを得るが、ブロックは得られないため。,球体。球体は働くトルクによって力学的エネルギーを得るが、ブロックは得られないため。,ブロック。ブロックは摩擦によって力学的エネルギーを失わないが、球体は失うため。,ブロック。ブロックは回転運動エネルギーを得ないが、球体は得るため。,D
二重スリット干渉実験に次のどの変更を加えると、スクリーンに現れる干渉パターンの縞の幅が大きくなるか?,波長の短い光を使う。,スクリーンをスリットに近づける。,スリットを近づける。,波速の小さい光を使う。,C
石を初速5m/sで上方に垂直に投げる。3秒後の石の速度はどうなるか?,25m/s、上向き,25m/s、下向き,35m/s、上向き,35m/s、下向き,B
ある粒子は、ポテンシャルエネルギー関数がU(x)=(x−2)3−12xである保存力を受けている。Uはジュールで与えられ、xはメートルで計測される。次のうち安定した平衡の位置を表すものはどれか?,x=−4,x=−2,x=0,x=4,D
電子(質量=m、電荷=−E)は、ページの平面内で上方向に速度Vで回転し、ページの平面に向けられた一様な磁場Bを含む領域に入る。その後の電子の円運動について述べよ。,時計回りの回転; 経路の半径=mv/(eB),反時計回りの回転; 経路の半径=mv/(eB),時計回りの回転; 経路の半径=eB/(mv),反時計回りの回転; 経路の半径=eB/(mv),A
質量のある球が、天井につながれたひもに取り付けられて振り子を形成している。ひもを水平(天井)から50度の角度まで上げて放すと、球は0.4秒の周期で前後に振れる。次のうちどの変更を振り子に加えると振り子の周期が短くなるか?,ボールの質量を増やす,糸の長さを短くする,糸を放したときの水平からの角度を小さくする,ボールの質量を減らす,B
物体を遠くから焦点の近くまで移動させると、凹面鏡によって形成される像はどうなるか?,像が鏡から遠ざかり、背が短くなる。,像が鏡から遠ざかり、背が高くなる。,像が鏡に近づき、背が低くなる。,像が鏡の方に移動し、背が高くなる。,B
最初は静止していた半径0.1mの円板は、2.0rad/s^2の角加速度を受ける。円板が回転するだけの場合、円板の縁の点が4.0sで移動した総距離を求めよ。,0.4m,0.8m,1.2m,1.6m,D
橋から初速10m/sで石を水平に投げる。空気抵抗を無視できると仮定すると、石が橋の下80mの水面に衝突するまでにかかる時間はどれか?,1秒,2秒,4秒,8秒,C
電場と磁場に関する次の記述のうち、誤っているものはどれか?,電場の方向に沿って移動する電荷は力を受けるが、磁場の方向に沿って移動する電荷は力を受けない。,電場ではすべての電荷が力を受けるが、磁場では移動する電荷だけが力を受ける。,正電荷は電場の方向に動き、正電荷は磁場に垂直に動く。,すべての動く電荷は、電場に平行な力と磁場に垂直な力を受ける。,C
"スペースシャトルが地球の表面から300km上を回る。地球の半径は6,400kmである。スペースシャトルが受ける地球の重力による加速度はどれか?",4.9m/s^2,8.9m/s^2,9.8m/s^2,10.8m/s^2,B
閉じ込められた理想気体が、等圧ステップ、等積ステップ、等温ステップの順番の3つのステップによる循環過程を受ける。次のうちどれが正しいか?,気体の内部エネルギーの変化は、等圧ステップで行われた仕事に等しい。,気体の内部エネルギーの変化は、等圧ステップで行われた仕事から等温ステップで行われた仕事を引いたものに等しい。,サイクル中に行われる仕事の合計は正。,サイクル中に行われる仕事の合計は、正味の熱移動量と等しいが反対。,D
ある球体が、傾斜角度が一定の丘の上で静止している状態から出発し、丘を滑り落ちることなく転がるようにする。球体を回転させるトルクを与える力は何か?,静止摩擦,運動摩擦,球体にかかる丘の法線力,重力,A
あるブロックがテーブルに沿って引きずられ、その動きに対抗する摩擦力f を受ける。テーブルがブロックに及ぼす力はどうなるか?,ゼロ,テーブルに平行,テーブルに垂直,テーブルに平行でも垂直でもない。,D
テーブルの上に置かれた木のブロックをテーブルが支えている。この相互作用は自然界のどの基本的な力によるもので、その理由は何か?,電気力。テーブルの最上層の原子核に含まれる陽子が、木の最下層の原子核に含まれる陽子を反発させるから。,重力。F=GMm/r^2により、その至近距離でテーブルが木材に及ぼす力は、地球が木材に及ぼす力と釣り合うのに十分だから。,電気力。テーブルの一番上の原子層の外側の電子が、木材の一番下の原子層の外側の電子と反発するから。,強い核力。テーブルの一番上の原子層の原子核の陽子が、木材の一番下の原子層の原子核と反発するから。,C
次のうち、1テスラに等しくないものはどれか?,1J/(A*m^2),1kg/(C*s),1N/(A*m),1A*N/V,D
ある子供用おもちゃは、非常に軽い車輪が輪ゴムに取り付けられたカートで構成されている。この輪ゴムは、車輪を支える車軸に巻きつけたり巻き戻したりすることができる。このおもちゃをひと押しすると、おもちゃは平らな面を転がり、スロープを登っていく。おもちゃがスロープを昇る距離には一貫性がないことが観測され、カートを押し出す力が毎回同じ運動エネルギーであるにも関わらず、あるテストでは他のテストよりも高い位置まで上った。この現象の説明として妥当なものはどれか?,輪ゴムの最初の巻き方によって、輪ゴムからカートが動くための運動エネルギーに伝達される位置エネルギーが多くなったり少なくなったりする。,輪ゴムの巻き方、巻き戻し方によって、カートの車輪にかかる法線力は異なる。,運動エネルギーから重力位置エネルギーにどれだけのエネルギーが伝達されるかは、カートが行き着く垂直の高さによる。,カートの最初の運動エネルギーの一部は、摩擦による仕事によって散逸する。,A
ある物体が静止状態から解放され、最初の1秒間に距離hだけ落下する。次の1秒間に物体はどこまで落下するか?,h,2h,3h,4h,C
2人のアイススケーターが摩擦のない氷の上を動き、衝突しようとしている。50kgのスケーターは真西に4m/sで進んでいる。75kgのスケーターは2m/sで真北に進んでいる。衝突後、両者は密着した。このシナリオでは、次のうちどれが正しいか?,衝突の間、系にかかる正味の力はゼロではないので、系の直線運動量は保存される。,非弾性衝突なので、系の運動エネルギーだけが保存される。,弾性衝突なので、系の運動エネルギーだけが保存される。,系にかかる正味の力がゼロなので、系の直線運動量は保存される。,D
地球の質量は5.97×10^24kgである。月の中心は地球の中心から3.84×10^8mの距離にあり、月の質量は7.35×10^22kgである。月に対する地球の引力の推定値として最も適切なものはどれか?,10^39N,10^29N,10^19N,10^9N,C
体積2×10^−3m^3、重さ6Nの物体が水槽に入れられ、浮いている。その物体の体積の何％が水面上にあるか?,12%,30%,60%,70%,D
ある物体の位置は方程式x=2.0t^3+4.0t+6.25で得られる。t=1.50秒における物体の加速度はどれか?,6m/s^2,12m/s^2,18m/s^2,24m/s^2,C
ある人がエレベーターの中に立っているときにエレベーターが上昇を始めた。床からの法線力はその人に働くか?,はい。正の力が働く。,はい。負の力が働く。,はい。ただし、その符号は不明。,いいえ。,A
静止状態から出発し、5m/s^2の速度で直線に一様に加速している車が200mの距離を走るのにかかる時間はどれか?,9.0秒,10.5秒,12.0秒,15.5秒,A
物体が静的平衡にあるために必要な条件は次のうちどれか? I. 物体にかかるすべてのトルクのベクトル和がゼロでなければならない。 II. 物体にかかるすべての力のベクトル和はゼロに等しくなければならない。 III. 物体の位置エネルギーと運動エネルギーの和はゼロでなければならない。,Iのみ,IIのみ,IIIのみ,IとIIのみ,D
ある学生がテーブルを横切るようにパックを押し出し、x=0の位置からx=0.2mの位置へと動かす。学生が手放した後、パックはテーブルを横切って進行を続け、x=1.2mの位置で静止した。パックがx=1.0mの位置にあるとき、パックにかかる正味の力について正しい主張はどれか?,パックは正の方向に動いているが減速しているので、正味の力は負の方向。,パックは地面の近くにあり、重力加速度は下向きに10m/s^2であるため、正味の力は下向き。,学生が押したことによってパックが正の方向にスピードアップしたため、正味の力は正の方向。,学生が押したことによる正の方向の力は、負の方向の摩擦力と等しくなければならないので、正味の力はゼロ。,A
実験者Aは非常に小さな試験電荷qoを使用し、実験者Bは試験電荷2qoを使用して、2枚の平行なプレートから発生する電場を測定する。Aの見いだした電場はどうなるか?,Bの見いだした電場より大きい,Bの見いだした電場と同じ,Bの見いだした電場より小さい,試験電荷の加速度に応じて、Bの見いだした電界より大きいか小さいかのどちらか,B
2つの物体AとBは、同じ電荷と同じ質量を持つ。両者間の重力と静電気力は等しいので、どちらの物体も運動していない。物体Aの質量を半分にした場合に平衡が維持されるのはどのような場合か?,物体Aの電荷を2倍にした場合,物体Bの電荷を半分にした場合,物体Bの電荷を2倍にした場合,物体Bの質量を半分にした場合,D
2μFのコンデンサがバッテリーに直接接続されている。コンデンサが完全に充電されると、600μCの電荷を蓄える。実験者は2μFのコンデンサを、同じバッテリーに直列に接続された3つの18μFのコンデンサに置き換えた。コンデンサが完全に充電されると、各コンデンサに蓄えられる電荷はどうなるか?,100μC,200μC,600μC,1800μC,D
ある粒子の速度が3.0m/sのとき、粒子の運動エネルギーは−6.0J/sの割合で変化している。この時、粒子にかかる力の大きさはどれか?,0.5N,2.0N,4.5N,9.0N,B
半径が一様なバンクカーブを車が曲がっている。車には、タイヤと路面の間の摩擦力、路面からの法線力、車の重さの3つの力が働く。車を円運動に保つ向心力はどれか?,摩擦力のみ,法線力のみ,重量のみ,法線力と摩擦力の二つ,D
橋から初速30m/sで石を水平に投げた。空気抵抗が無視できると仮定して、4秒後に水中に入ったときの石の全速度を求めよ。,30m/s,40m/s,50m/s,60m/s,C
それぞれの物体の質量を2倍にし、中心間の距離を2倍にした場合、2つの小さな物体間の引力はどうなるか?,2倍になる。,4倍になる。,半分になる。,変わらない。,D
60Wの電球が120Vの電圧で作動する場合、どれだけの電流を流すか?,0.25A,0.5A,2A,4A,B
温度が2倍、体積が8倍になると、理想気体の圧力Pはどうなるか?,Pは16分の1に減少する。,Pは4分の1に減少する。,Pは2分の1に減少する。,Pは4倍に増加する。,B
空気中から窓ガラスに入ってきた単色光の光線は何が変化するか?,周波数と波長,周波数と速度,速度と波長,速度のみ,C
体積が一定の硬い固体容器に、体積v1、温度T1、圧力P1の理想気体を入れる。温度は等温過程で上昇する。次のうち正しくないものはどれか?,分子の平均速度は上昇する。,圧力は上昇する。,系の運動エネルギーは増加する。,体積は増加する。,D
一定の張力と線質量密度の弦が振動スピーカーに取り付けられている。スピーカーの周波数が60Hzの場合、弦に定在波が発生しないことが観察された。この現象について正しい説明はどれか?,弦の長さが波の波長の半分の倍数になっていない。,弦の波の速度は一定。,60Hzは可聴音の最低音域。,スピーカーから発生する波の波長は、弦上の波の速度を60Hzで割ったものに等しい。,A
