これらのうち、電場を発生させる物体から距離が遠くなると、距離の逆二乗分減少するものはどの量か?,有限長の帯電棒が作る電場,無限に長い帯電円柱が作る電場,無限に長い帯電平面が作る電場,無限に長くまっすぐな通電ワイヤーが作る磁場,A
固体の金属物体が他の電荷から隔離され、その表面に電荷が分布している。電荷分布は一様ではない。どのようなことが正確に判断できるか?,物体の外側の電場はゼロ,物体の外側の電場は、物体内部の電場と等しい,物体の外側の電場は、物体の質量中心からの距離に正比例する,物体の外側で、ただし物体の表面に非常に近い電場は、任意の位置の表面電荷密度を自由空間の誘電率で割ったものに等しい。,D
定在波が一定の長さの弦に100Hzの発生器で発生している。弦の張力を新しい定在波が発生するまで増加させる。新しい定在波の波長は、元の定在波の波長より大きくなるか小さくなるか?,弦の張力は波の速度に正比例し、波の速度は波長に反比例するため、小さくなる。,弦の張力は波の速度に正比例し、波の速度は波長に反比例するため、大きくなる。,弦の張力は波の速度に正比例し、波の速度は波長に正比例するため、大きくなる。,弦の張力は波の速度に正比例し、波の速度は波長に正比例するため、小さくなる。,C
二つの同じコンデンサが並列に外部回路に接続されている。両方のコンデンサで同じでなければならない量はどれか? I. コンデンサに蓄えられた電荷 II. コンデンサを通る電圧 III. コンデンサの静電容量,Iのみ,IIのみ,IIとIIIのみ,IとIIとIII,D
粗い表面の傾斜の頂上から、1kgの物体が静止状態から解放される。物体は回転することなく傾斜の底まで滑る。底部での物体の運動エネルギーはどうならなければならないか?,全力学的エネルギーが保存されなければならないため、物体が解放されたときの重力による位置エネルギーと等しくなる。,運動エネルギーの増加が、粗い傾斜で熱エネルギーによって失われた力学的エネルギーを補うので、物体が解放されたときの物体の重力による位置エネルギーと等しくなる。,重力による位置エネルギーが熱エネルギーと運動エネルギーの両方に変換されたため、物体が解放されたときの重力による位置エネルギーより小さくなる。,摩擦力によって加えられた負荷は物体が得た運動エネルギーより大きくなければならないため、物体が解放されたときの重力による位置エネルギーより小さい。,C
ある学生が、ばね定数kと振幅Aの単純なバネとブロックによる振り子を使って実験をしている。バネに取り付けられたブロックの質量はmである。学生が元のブロックの上に質量mの小さなブロックを置いた場合、次のうちどれが正しいか?,小さなブロックは、元のブロックが平衡位置から最大変位しているときに滑り落ちる可能性が最も高くなるが、ブロック間の静止摩擦係数がkA/[(M+m)g]より大きい限り、滑り落ちることはない。,小さなブロックは、元のブロックが平衡位置にあるときに滑り落ちる可能性が最も高くなるが、ブロック間の静止摩擦係数がkA/[(M+m)g]より大きい限り、滑り落ちることはない。,小さなブロックは、元のブロックが平衡位置から最大変位しているときに滑り落ちる可能性が最も高くなるが、ブロック間の静止摩擦係数が(M+m)g/(kA)より大きい限り、滑り落ちることはない。,小さなブロックは、元のブロックが平衡位置にあるときに滑り落ちる可能性が最も高くなるが、ブロック間の静止摩擦係数が(M+m)g/(kA)より大きい限り、滑り落ちることはない。,A
10µFのコンデンサを100Vの電位差まで充電するのに必要な仕事量はどれか?,0.005J,0.01J,0.05J,0.1J,C
質量mの箱が水平面上を初速v0で滑る。箱は重力と表面からの力以外には何の影響も受けない。箱と表面との間の動摩擦係数をμとすると、箱が静止するまでに滑る距離はどのようになるか?,v0^2/(2μg),v0^2/(μg),2v0^2/(μg),mv0^2/(μg),A
地面に静止しているサッカーボールを、初速10m/sで、打ち出し角30°で蹴る。空気抵抗は無視できると仮定して、その総飛行時間を計算しなさい。,0.5秒,1秒,2秒,4秒,B
2つの同じ容器に異なるガスが充填されている。容器1には水素を入れ、容器2には窒素を入れた。それぞれの容器を実験台の上に置き、部屋と熱平衡になるようにする。2つの気体の性質を正しく比較したものはどれか?,水素ガスの平均運動エネルギーは窒素ガスより大きい。,水素ガスが容器に及ぼす平均力は、窒素ガスより大きい。,水素ガスの密度は窒素ガスより小さい。,それぞれの容器に含まれる分子の数がわからないと、ガスの圧力は比較できない。,D
質量mの女の子と質量2mの男の子が、中央に支点のあるシーソーの反対側に座っている。今、少年と少女は支点から等しく離れており、シーソーは少年の方に傾いている。シーソーのバランスをとる方法として考えられないものは次のうちどれか?,男の子を支点から元の半分の距離に動かす。,支点から元の2倍の距離に女の子を移動させる。,質量mの2人目の女の子が1人目の女の子に加わるようにする。,支点と男の子の距離を半分にする。,D
冷たいアルコールの入ったビーカーに熱い水を注ぐと、混合物の温度はやがて同じ温度になる。流体の分子の大きさを考慮すると、この現象が起こる主な理由はどれか?,高温の水は冷めるまで容器の上部に上昇し、アルコールと混ざり合う。,水の分子はアルコールの分子より高い運動エネルギーを持ち続けるが、2つの液体はエネルギーが容器全体に均等に行き渡るまで混ざり合う。,熱い水は熱放射を起こし、すべての分子の運動エネルギーが同じになるまで、冷たいアルコールに吸収される。,水の分子とアルコールの分子が衝突し、水とアルコールの分子の平均運動エネルギーが同じになるまでエネルギーが移動する。,D
固体球体（I=0.06kg·m^2）が、その中心を通る軸の周りを20rad/sの角速度で自由に回転している。球の中心から0.30m離れた球の外面に2.0Nの摩擦力を加えて球を静止させたい。球体が静止するまでにかかる時間はどれか?,4秒,2秒,0.06秒,0.03秒,B
火星の半径は地球の約半分、質量は地球の約10分の1である。火星表面の重力場に最も近いものはどれか?,10N/kg,4N/kg,2N/kg,0.5N/kg,B
電荷密度σの無限に大きな平面の上では、電場は上を向き、σ/2εoに等しい。平面の下の電界の大きさと方向はどれか?,σ/2εo、下,σ/2εo、上,σ/εo、下,σ/εo、上,A
電子ビームの速度は10^7 m/sである。地球の磁場5×10−5 Tを使って電子ビームを円になるように曲げたい。この円の半径はどうなるか?,1nm,1μm,1mm,1m,D
平面鏡から100cmの距離に物体が置かれている。像と物体との距離はどれか?,50cm,100cm,200cm,300cm,C
馬の後ろに静止している荷車がある。馬と荷車のシステムが静止状態から加速することができるのは、どの力、または力の組合せで説明できるか?,馬にかかる地面の前方への静止摩擦力が、荷車にかかる後方への摩擦力よりも大きくなることで、前方への加速が得られる。,馬が荷車に及ぼす前方への力が、荷車が馬に及ぼす後方への力より大きくなることで、前方への加速が得られる。,馬と荷車のシステムの残りの部分にかかる馬の筋肉の力によって、必要な加速度が得られる。,馬にかかる地面の上向きの法線力が、馬の体重よりも大きくなることで、上向きの加速度が得られる。,A
"ある領域では、電界は原点から半径が離れるにつれて、Er = −6r^2 + 4r + 3 の式で変化し、rはメートル、EはN/Cで与えられる。原点と点(3, 4)の間の電位差はどれか?",−165V,−120V,64V,185V,D
ある気体が膨張-圧縮サイクルを行う。P-V線図にプロットすると、サイクルは反時計回りで、仕事の大きさは300Jである。このサイクルでの伝熱はどうなるか?,系への300Jの流入,系からの300Jの流出,系への600Jの流入,系からの600Jの流出,B
定電圧Vの理想的な電池が、全抵抗Rを持つ回路に電流を供給している。Rを2倍にした場合、回路から失われる電力の合計はどうなるか?,2倍になる。,4倍になる。,半分になる。,変わらない。,C
ある紫外線の波長は約6×10^−8mである。この光の周波数はどれか?,5×10^15Hz,0.5Hz,2Hz,20Hz,A
次の電離同位体はそれぞれ、同位体の初速度がBに垂直になるように、一様な磁場Bに同じ速度で投射される。質量と電荷の組み合わせで、半径が最大の円軌道になるのはどれか?,m=16u、 q=−5e,m=17u、q=−4e,m=18u、q=−3e,m=20u、q=−1e,D
電気双極子は、大きさ4.0nCの等しいが対向する一対の点電荷からなり、2.0cmの距離で隔てられている。電荷の中間にある点の電界強度はどれか?,0,9.0×10^4N/C,1.8×10^5N/C,7.2×10^5N/C,D
人は寒い日に何時間も外に立っていても何の悪影響も受けないが、冷たい湖に落ちると数分で命を落とすことがある。この現象の主な理由はどれか?,人の分子は、平均して周囲の分子よりも速く動く。,熱エネルギーが高濃度領域（熱い）から低濃度領域（冷たい）へ移動する。,熱が人から流れ出て人を囲む流体を温めると、より温かい流体が上昇し、新鮮な冷たい流体が人に接触できるようになり、熱の移動速度が増加する。,水は空気よりも体積あたりの分子数が多いため、人との分子接触が増加する。,D
直径の異なる円形の断面を持つパイプの中を、一定の流量で液体が流れている。パイプのある点での直径は2cmで、流速は18m/sである。このパイプの直径3cmの別の点での流速は何m/sか?,4m/s,6m/s,8m/s,12m/s,C
理想流体が半径Q、流速Vのパイプを流れる。パイプが3つの別々の経路に分かれ、それぞれが半径 (Q/2) である場合、それぞれの経路を流れる流速はどれか?,1/3V,2/3V,4/3V,4V,C
非常にゆっくりと動く陽電子が静止している電子と相互作用する。次の記述のうち、この反応によって起こりうる結果と、それが起こる理由を正しく説明しているものはどれか?,質量保存の法則から、この反応で新しい粒子が1つ生成された場合、その質量の合計は電子と陽電子の質量の合計に等しくなければならない。,電荷保存則から、この反応で生成されるすべての新しい粒子が電荷を持たないことが示されている。,運動量保存の法則から、反対方向に進む2つの同じガンマ線が生成される可能性がある。,エネルギー保存の法則から、反物質の陽電子がエネルギーに消滅し、静止した電子が残ることが示されている。,C
ある箱が傾斜面の上に滑ることなく置かれている。（水平面からの）角度が大きくなるにつれて、法線力はどうなるか?,直線的に増加する,直線的に減少する,変化しない,非線形的に減少する。,D
質量mの小さな荷車は最初静止している。質量4m、速度vの大きな荷車と弾性衝突した。大きな荷車は小さな荷車のためにその運動エネルギーの半分を失った。このときの小さな荷車の速度はどれか?,1.41v,v,2v,4v,A
ある回路はバッテリーと電球で構成されている。最初は回路が切断されている。次に回路が接続され、電球が点灯する。電球が点灯してしばらくの後、回路素子に存在する正味電荷はどのように変化したか?,正味電荷はよりプラスになった。,正味電荷はよりマイナスになった。,正味電荷は変化していない。,正電荷がよりプラスになるか、よりマイナスになるかは、電球が点灯する前の回路素子上の初期正電荷に依存する。,C
もし月と地球の間の重力の力が止まったとしたら、その結果生じる月の運動を最もよく表している記述はどれか?,月は自転を続け、通常通り地球の周りを公転する。,月は自転を続けるが、地球の周りを公転しなくなる。,月は自転しなくなるが、地球の周りを通常通り公転する。,月は自転をしなくなり、地球の周りを公転することもしなくなる。,B
ある人がエレベーターの中で体重計に乗った。彼は体重計の数値が普段の体重より少ないことに気づいた。エレベーターの動きを表す可能性があるのは次のうちどれか?,エレベーターは下向きに動き、減速している。,エレベーターが上方に移動し、減速している。,一定の速度で上方に動いている。,一定の速度で下向きに動いている。,B
"ウィッフルボールが真上に投げられ、最高点に達し、下に落ちる。空気抵抗は無視できない。次の記述のうち正しいものはどれか?
I. ボールの速度は最高点でゼロである。
II. ボールの加速度は最高点でゼロである。
III. ボールは最高点まで上がるのに落ちるより長い時間がかかる。",Iのみ,IIのみ,IとIIのみ,IとIIIのみ,C
L、M、Tがそれぞれ長さ、質量、時間の大きさを表すとき、衝撃の大きさはどうなるか?,LM/T^3,LM/T^2,LM/T,L^2M/T^2,C
1.5×10^6m/sの初速で移動している陽子は、大きさ1.5Tの一定磁場の領域に入る。陽子の初速度ベクトルが磁場と30°の角度をなす場合、磁場に入ってから4秒後の陽子の速度を計算しなさい。,5.0×10^6m/s,7.5×10^6m/s,1.5×10^6m/s,3.0×10^6 m/s,C
ある男性がエレベーターの中で台秤の上に立っている。エレベーターは速度を上げながら上方に移動する。男性の体重に対する作用反作用の力の組み合わせはどれか?,エレベーターのケーブルが男性に及ぼす力,男性が体重計に及ぼす力,エレベーターのケーブルがエレベーターに及ぼす力,男性が地球に及ぼす力,D
等温膨張の間、閉じ込められた理想気体は周囲に対して150Jの仕事をする。この過程での熱伝導を説明するものはどれか?,150Jの熱が気体に加えられた。,150Jの熱が気体から取り除かれた。,300Jの熱が気体に加えられた。,300Jの熱が気体から取り除かれた。,A
ある物体は−1Cの電荷を帯びている。この物体に含まれる過剰電子はどれか?,6.25×10^18,8.00×10^18,1.60×10^19,3.20×10^19,A
ギターの弦が既知の周波数の音波を発生させる。以下の記述のうち、メータースティックで音波の波長を測定する方法として、正しく実用的なものはどれか?,ギターの弦の真ん中に軽く触れ、一つの節ができるようにし、弦の長さを測ったものが波長。,ギターの弦の長さを測ったものが半波長。,共振が聞こえるように、弦の近くに置いたパイプの長さを調整する。連続する共鳴のパイプの長さの差を測ったものが半波長。,波が通過するときのピークからピークまでの距離を測ったものが波長。,C
像に関する次の記述のうち、正しいものはどれか?,凹レンズによって作られる像は常に実像。,凹面鏡によって作られる像は常に実像。,凸レンズによって作られる像は、実像と虚像の両方になりうる。,凸面鏡によって作られる像は、実像と虚像の両方になりうる。,C
地球の中心から反対側までまっすぐ穴を掘ることができたとする。その穴に物体が落とされた場合、その動きを最もよく表すのは次のうちどれか?理想的な条件で、物体が破壊されないと仮定する。,物体は地球の中心まで落下し、そこで止まる。,穴を通って反対側へ落下し、反対側の開口部を通過して宇宙へ飛んでいく。,一方の開口部から他方の開口部まで、無限に往復する。,反対側に落下し、そこで止まる。,C
水平のバネとブロックによる振り子が動いているとき、同じ質量の2つ目のブロックが振動しているブロックの上に落ちてきた。二つのブロックがくっつくと、振動の振幅にどのような影響があるか?,振幅が大きくなる。,振幅が小さくなる。,何の影響もない。,2つ目のブロックが落下したとき、元のブロックがサイクルのどの位置にあったかによる。,D
音源とその音を検出する検出器が関係する次の状況のうち、ドップラーシフトが認められない可能性があるのはどれか?,音源が静止している検出器に向かって移動する。,検出器が静止している音源に向かって移動する。,音源と検出器の両方が同じ方向に移動する。,音源と検波器が互いに反対方向に移動し、音源と検波器が互いに遠ざかる。,C
質量100kgの一様な密度を持つ固体のプラスチック立方体（一辺の長さ＝0.5m）を、密度1200kg/m^3の流体槽に入れた。この立方体の体積の何分の一が液面上に浮いているか?,1.0/9,1.0/3,2.0/3,4.0/5,B
水平な床の上に立っている人には、下向きの重力と上向きの床の法線力という2つの力が作用する。これらの2つの力について正しいものはどれか?,大きさが等しく、作用・反作用の対を形成する,大きさが等しく、作用・反作用の対を形成しない,大きさが等しくなく、作用・反作用の対を形成する,大きさが等しくなく、作用・反作用の対を形成しない。,B
質量m、電荷Q、速度Vの粒子は、強さEの一様な電界に向けられ、距離dを移動する。元の速度を2倍にし、質量を半分にした場合、粒子はどれだけの距離を移動するか?,4d,2d,d,1/2d,B
質量m1の物体が、質量不明の静止した物体と直線的な弾性衝突をする。m1に加えて、2番目の物体の質量を決定するために最低限必要な情報は何か?,物体1の最終速度,物体1の初速度,物体2の最終速度,上記のうちいずれか2つ,D
光電効果を研究するために計画された実験で、波長550nmの低強度の可視光では光電子が発生しないことが観察された。この光の強度を劇的に増加させた場合、何が起こるかを最もよく表しているのは次のうちどれか?,ほぼ直ちに、入射光子のエネルギーに等しい運動エネルギーを持つ光電子が生成される。,ほぼ直ちに、入射光子のエネルギーから金属の仕事関数を引いたものに等しい運動エネルギーを持つ光電子が生成される。,電子が入射光から十分なエネルギーを吸収するのに必要な数秒後、入射光子のエネルギーから金属の仕事関数を引いたものに等しい運動エネルギーを持つ光電子が生成される。,何も起こらない。,D
振幅4cmと6cmの等しい周波数の2つの進行波が、1つの媒質中で重畳している。その結果生じる波の変位Dを表すのに、最も適切なものはどれか?,2cm≤D≤10cm,D=5cm,D=10 cm,10cm≤D≤12cm,A
衝突Aでは、2台のカートが衝突し、互いに跳ね返る。衝突Bでは、ボールが剛体の棒にくっつき、その棒は組み合わされた重心を中心に回転し始める。それぞれの衝突における量に関する次の記述のうち正しいものはどれか?,衝突A： 各カートは同じ力、衝突時間、運動エネルギーの変化を経験する。 衝突B： ボールとロッドはそれぞれ同じトルク、衝突時間、回転運動エネルギーの変化を経験する。,衝突A: 各カートは同じ力、衝突時間、直線運動量の変化を経験する。 衝突B： ボールとロッドはそれぞれ同じトルク、衝突時間、角運動量の変化を経験する。,衝突A: 各カートは同じ力、衝突時間、運動エネルギーの変化を経験する。 衝突B： ボールとロッドはそれぞれ同じトルク、衝突時間、角運動量の変化を経験する。,衝突A： 各カートは同じ力、衝突時間、速度の変化を経験する。 衝突B： ボールとロッドはそれぞれ同じトルク、衝突時間、角速度の変化を経験する。,B
質量2kgの物体に、それぞれ4Nの大きさの3つの外力が作用している。物体に及ぼす加速として不適切なものはどれか?,0m/s^2,2m/s^2,4m/s^2,8m/s^2,D
ばねばかりを使用して物体にかかる正味の力を測定し、音波モーションディテクターを使用して物体の結果として生じる加速度を測定する。縦軸に正味の力、横軸に加速度をとってグラフを作成する。このグラフの傾きを使って直接測定される量は、次のうちどれか?,重力質量,重量,速度,慣性質量,D
木のブロックがテーブルの上を滑るとき、摩擦力fを受ける。高さが半分、長さが2倍の同じ材質のブロックがテーブルの上を滑るとき、そのブロックが受ける摩擦力はいくらか?,(1/2)f,f,2f,4f,B
発散鏡の前10cmに物体を置く。鏡の後方2cmに像が見える場合、鏡の焦点距離はどれか?,−3/5 cm,−5/3 cm,−2/5 cm,−5/2 cm,D
正のx方向に移動している物体が原点を通過する時間はt=0である。t=0からt=1秒の間、この物体は毎秒24メートルの一定速度を持つ。t=1秒で、物体は負のx方向に毎秒6メートルの2乗の一定加速度を与えられる。t=11秒における物体の位置xはどれか?,99m,36m,−36m,−99m,C
密度ρの流体が粘性を無視できる水平パイプを流れる。流れは流線型で、流量は一定である。点1におけるパイプの直径をd、流速をVとする。点2におけるパイプの直径をd/3とすると、点2における圧力はどうなるか?,点1における圧力より4ρv^2小さい,点1における圧力より40ρv^2小さい,点1における圧力より4ρv^2大きい,点1における圧力より40ρv^2大きい,B
ばねとブロックによる振り子では、ブロックの最高速度はどうなるか?,振幅に比例する,振幅の2乗に比例する,振幅の平方根に比例する,振幅の平方根に反比例する,A
地球上の箱の重さは80Nである。月の質量が地球の1/80、半径が1/4である場合、月でのこの箱の重さはどれか?,1N,10N,16N,20N,C
"教科書は海面で30Nの重さがある。地球の半径は6,400kmである。海抜6,000mの山頂における教科書の重さの推定値として最も適切なものはどれか?",60N,15N,30N,7.5N,C
自由落下している実際の物体の運動を正しく表しているのはどれか?物体は速度に比例した抗力を受け、終端速度に達する前に地面に衝突すると仮定する。,速度が増加し、加速度が増加しながら落下する。,速度が増加し、加速度が減少しながら落下する。,速度が減少し、加速度が増加しながら落下する。,速度が減少し、加速度が減少しながら落下する。,B
両凸レンズの曲率半径の大きさは20cmである。高さ2cmの物体がレンズから30cmのところに置かれたときに結ばれる像について、最も適切な記述はどれか?,実像、倒立、高さ=1cm,虚像、正立、高さ=0.25cm,実像、正立、高さ=1cm,虚像、倒立、高さ=0.25cm,A
正味電荷+5eと−6eの2つの球が短時間接触した。その後の2つの球体の正味電荷の組み合わせとして可能なものは次のうちどれか?,+3eと−4e,+1.5eと−2.5e,上記の両方,上記のどれでもない,A
