インドネシアのスラウェシ島の洞窟で、世界最古の絵画が最近発見された。その絵の内容と年代は?,"15,000年以上前から約20,000年前までの動物と人体","35,000年以上前から約40,000年前までの動物と手型","45,000年以上前から約10万年前までの動物と手型","15,000年以上前から10万年前までの動物と抽象的な幾何学図形",B
現在の地球の姿は、一連の自然災害によってもたらされたと説明するのが最も適切であると考える人は、次のうち何として知られているか?,古人類学者,自然科学者,進化論者,カタストロフィスト,D
社会が複雑化する要因は何か?,余剰食糧は大規模な集団施設に貯蔵される。,作物の灌漑にはダムや運河の建設が必要。,定住型社会は自らを守る必要がある。,上記のすべて。,D
_________は一次ごみを含み、_________は二次ごみを含む。,台所、庭,活動エリア、埋葬,ピクニック場、ゴミ捨て場,活動エリア、リサイクルエリア,C
人工物は＿＿＿＿、エコファクトは＿＿＿＿＿,価値があって希少であり、手に入れやすい。,腐敗が早く、長い時間持続する。,人間によって作られたもので、人間の活動の痕跡を示す。,芸術に関する事実であり、自然に関する事実である。,C
ポンペイが珍しくよく保存されていたのは、次のうちどの理由からか?,火山性の軽石の層が遺跡を密閉した。,雪崩が遺跡を海に押し流し、海水が物を保存した。,有毒な火山ガスが人々を即死させた。,ローマ人は犠牲者を海水の塩で防腐処理した。,A
チャールズ・ライエルは、次のうちどの事実に基づいて地球は極めて古いはずだと主張したか?,観測可能な多くのプロセスは、極めてゆっくりと作用する。,一様主義は、地質学上の重要な特徴を説明できる。,浸食は驚くほどゆっくりと進行する。,上記のすべて。,D
フローレス島のホモ・フローレシエンシスは約35000年から14000年前に遡り、一部の研究者によると、以下のうちどれに類似または関連があるとされるか?,ホモ・エレクトス,ホモ・ハビリス,ホモ・エルガスター,アウストラロピテクス・アファレンシス,A
人々の自給自足の習慣は、次のうちどれを復元し研究することによって知ることができるか?,遺跡の動物群の集団。,遺跡からの骨学的比較採集物。,軽石と火砕サージの痕跡。,上記すべて,A
スペインの探検家エルナンド・デ・ソトが北米大陸の一部を横断したとき、彼の探検隊はどの民族の直系の子孫に遭遇したか?,ミシシッピ人,アデナ人,古代プエブロ人,クワキウトル人,A
紀元800年頃に終わった古典期の後、マヤ文明は次のうちどのようになったか?,不可解にも姿を消し、その後ゆっくりとした発展を始め、アステカ文明で終わった。,第二次古典期に入り、テオティワカンとの大戦に敗れ、いなくなった。,衰退し、その中心を北に移し、復活し、再び衰退した。,急激に衰退し、人口が消滅し、二度と記念碑的建造物を建てなかった。,C
中新世後期の間、炭素同位体分析は、現生人類のヒト科の祖先に影響を与えたであろう環境の変化を示している。これらの変化をもっともよく特徴づけるのは次のうちどれか?,氷河期の状態に戻ることになる急激な地球の気温の低下。,急激な地球の気温上昇により海面が上昇した。,草原が拡大し、森林地帯が減少した結果、地域のモザイク的環境が形成された。,大型哺乳類の個体数が減少し、その他の種類の脊椎動物種が相対的に増加する。,C
現生人類の次の特徴のうち、最も古く、後期石器時代、後期旧石器時代、さらには解剖学的に現生人類よりも古いものはどれか?,入念な埋葬,より大規模な遺跡とより多くの人口,改良された石器技術,芸術作品の制作による象徴的表現,C
腕を振って木の間を移動することをどう呼ぶか?,二足歩行,腕渡り,四足歩行,サバンナのニッチ,B
トルコ中部のチャタル・ヒュユクは、なぜ都市ではなく大きな村とみなされているのか?,宮殿や公共建築がなく、身分の違いを示す証拠がほとんどなかった。,食料の貯蔵、家畜化された動物、建物の証拠がなかった。,都市に関連する芸術作品、儀式、活動がなかった。,記念碑的建築物や道路の証拠がなかった。,A
次のうち、文明の4つの特徴はどれか?,豊富な食糧、専門家、都市集落、記録システム,豊富な食糧、常備軍、美術品、配管システム,豊富な食糧、記念碑的建築物、宗教建築物、博物館,博物館、図書館、記念碑的建築物、美術品,A
次のうち、後期旧石器時代における人類の知性の進歩を最も強く示しているものはどれか?,洞窟絵とポータブルアート,新しい石器技術,地元産以外の原材料の獲得,居住パターンの変化,A
次のうち、太平洋の先住民の航海士が熟知していなかった技術はどれか?,鳥の飛行経路,海流と風のパターン,磁極に対する磁気方位,雲のパターン,C
石器の複製と脳撮像による最近の研究は、次のうちどのような仮説を示唆しているか?,道具製作で作られた接続は、言語を生成し使用するための脳の準備となる。,道具作りには、言語がなければ成り立たない協力が必要。,道具作りは言語が進化した数百万年後に始まった。,脳と二足歩行運動との間に作られた結合が、道具作りのために手を準備した。,A
青銅の最も古い使用例は、次のうちどこで発見されているか?,南米,メソポタミア,インダス川流域,中国,D
クリストファー・コロンブスによって「発見」されたアメリカ大陸には、およそ何人の人々が住んでいた?,10万人,50万人,100万人,数千万人,D
次の遺跡のうち、約3500年前に作られた半円形の同心円状の尾根を持つ記念碑的な土塁があるのはどれか?,カラル,ストーンヘンジ,ポヴァティ・ポイント,ギョベクリ・テペ,C
現在のヨーロッパから来た人々が更新世の終わりに北アメリカを植民地化したという論争の的となっている説は、次のうちどれか?,アメリカ大陸最古の骨格とヨーロッパ人のゲノムとの間に密接なつながりがあることを証明する遺伝学的証拠によって支持される。,アメリカ大陸最古の骨格から得られた遺伝学的証拠によって、現代のネイティブ・アメリカンと中央シベリアの先住民との間に密接なつながりがあることが反証された。,アメリカ大陸最古の骨格と、西暦1000年頃にカナダ北東部に到着したノルウェー探検家との間に密接なつながりがあることを証明する遺伝学的証拠によって証明された。,アメリカ大陸へのヨーロッパ人の移住を記録した文書がまったくないことから、反論されている。,B
インカ帝国が所有する財産を使用する特権の見返りとして、王に対して義務づけられていた労働奉仕とは何か?,キープ,ミタ,分割相続,カパコチャ,B
考古学は次のうちどれのサブフィールドの一つか?,生物人類学,人類学,文化人類学,古人類学,B
遠距離からの原材料の入手が増えたのはいつで、それは何を示しているか?,後期旧石器時代、遠く離れた集団との交易に大きく依存した長距離的接触,中期旧石器時代、遠距離からの原材料の獲得は、人々がより頻繁に移動していたことを示す,中期旧石器時代、交易と長距離的接触のための頻繁な移動に基づく、より広範な社会的ネットワーク,後期旧石器時代、より高品質な輸入原材料の重要性がより広く認識された,A
著者によると、オルメカ族が異なる領土で結束していた共通点は何か?,オルメカの美術品や図像に見られるように、根底にある宗教的信念,経済的不平等を生み出すきっかけとなった農業の余剰,同じ言語を話し、親族関係や婚姻関係にあった,貨幣の一形態として使われたトークンに見られるように、交易と交換のシステム,A
メソポタミアの文書とは異なり、マヤが残した記録は主に次のうちどれに関するものか?,政治と軍事史,哲学と宗教,貿易と経済,天文学と数学,A
考古学的証拠に基づき、文明全般に関して正しいのは次のうちどれか?,人々が芸術作品の制作に時間を費やすようになると、戦争の発生は減少する。,戦争の発生は珍しく、富の集中に伴ってのみ発生する。,富の集中は一般的な特徴。,富の集中は珍しく、たまにしか起こらない。,C
約180万年前から約40万年前までのヒト科化石の形態から、研究者たちは次のうちどのように主張しているか?,この時期に、初期のアフリカのヒト科から進化した、関連はしているものの地理的に離れた2種以上のヒト科がいた,この時代のヒト科動物は、アフリカ、アジア、ヨーロッパの異なる種にグループ分けできる。,ホモ・ハビリスから進化し、ホモ・サピエンスより前に生まれたヒト科動物はすべて、ホモ・エレクトスとして知られる、単一の、地理的に広く分布しているが形態的には多様な種に属する。,上記すべて,D
さまざまな種類の生物の進化の歴史と、それらの相互の関係は、次のうちどれに示されているか?,正中離開,系統発生図,モザイク,属,B
オルドワン石器と比較すると、手斧は____________。,石、木、骨で作られている,定期的なクリーニングとメンテナンスが必要となる,鍛造するために金属と熱源が必要,さらに多くの薄片を除去する必要がある,D
ホモ・エレクトスはどの道具作りの伝統と最も密接な関係があるか?,オクシピタル,アシュール,オルドワン,スタディアル,B
日和見的採餌には次のうちどれが含まれるか?,綿密な計画とスケジューリング,貝類などの安定した食料源に頼る,輸入された、あるいは「外来」原料の使用が増える,ほとんど計画を立てない,D
まれに、古代の石器に残った血液は以下のうちどのようなことがあるか?,法医学人類学者だけが血まみれの道具を研究できるので、考古学者が研究するのを妨げている。,殺された動物や食べられた可能性のある動物の種を特定するために使用される。,狩猟に使用されなかった武器の種類を予測するために使用される。,上記のいずれでもない、すなわち血液は保存されず、石器上で同定されたことはない。,B
モチェの王墓はどのようにして発見されたか?,墓を荒らした泥棒が警察に捕まった。,森林火災によって、墓地を隠していた密生した植生が焼き払われた。,考古学者が地図室で都市の正確なレプリカを発見した。,そこに住んでいた羊の群れが墓に落ちた。,A
古代都市カホキアには＿＿＿以上の＿＿＿があり、約＿＿＿＿＿人の人口がいた。,"120、土塁、10,000","60、古墳、2,000","50、宗教的モニュメント、5,000","200、ピラミッド型墳丘、200,000",A
古代湖の堆積物から発見された腹足類の殻の酸素同位体比の分析によると、インダス文明に何がおこったか?,降雨量が増え、生育期が長期化し、ますます複雑化した。,気候変動と干ばつによってついに崩壊した。,モンスーンの増加と一連の壊滅的な大洪水によって崩壊した。,河川や湖岸に沿った一連の都市国家へと発展した。,B
クローヴィス・ポイントは＿＿＿＿＿＿＿では発見されていない。,アラスカ,メキシコ,カナダ,アメリカ本土,A
南西部で主に定住生活を送っていた文化はどれか?,アデナ,モゴロン,クワキウトル,ミシシッピ,B
ルイス・ヘンリー・モーガンは、人間文化の進歩を次のうちどの段階に分けて考えたか?,残虐、野蛮、文明。,残虐、文明、崩壊。,野蛮、原始、文明。,石器時代、青銅器時代、鉄器時代。,A
BP1900年までには、マヤ文化の中心的な要素は整っていた。これに含まれなかったのは次のうちどれか?,王によって支配された階層社会。,儀式的な球技と貴重なヒスイへの畏怖。,洗練された青銅生産産業。,象形文字で書かれた言語と暦。,C
マチュピチュは次のうちどれとして山中に建設されたか?,防御拠点,インカの雨の神を祀る寺院,エリートのための保養地,天体観測所,C
ネアンデルタール人が狩猟民族であったという証拠は?,ネアンデルタール人の犬歯は、彼らが生存のために肉だけに頼っていたことを示していた。,動物の骨には石器で切った跡があったが、動物の歯の跡はなかった。,象や馬などの大型動物の骨が洞窟から発見された。,AとCの両方。,B
ネアンデルタール人について、他の絶滅した前近代人よりも多くのことがわかっているのはなぜか?,ネアンデルタール人は世界中に広がり、その遺骨はすべての大陸で見つかっている。,ネアンデルタール人はヨーロッパで洞窟を利用しており、そこに遺体が保存されていた。,ネアンデルタール人の集団は、彼らが絶滅に追いやった他のどの前近代人よりも大規模で暴力的であった。,ネアンデルタール人は、粗いが理解しやすい文字記録を残した。,B
資源の消費に対する古代のエリートたちの態度は、次のうちどのようなものだったか?,「1ペニーの節約は1ペニーの稼ぎ」,持っているなら、それを誇示せよ,跳ぶ前に見ろ,最後の者が最初になり、最初の者が最後になる,B
1797年、ジョン・フレールはある発見をし、次のうちどのように記述したか?,地表に散らばった動物の遺体。,最も古い書き物の記録。,深部から発掘された原始的な石器。,猿に似た特徴を持つ人間の頭蓋骨。,C
石器時代、青銅器時代、鉄器時代という予測可能な年表に従って人類の文化を最初に説明したのは次のうちどれか?,一様主義,多線型進化,三時代区分法,三時代天変地異,C
チチカカに首都を持つティワナクは、古代世界の＿＿＿＿＿＿＿＿＿王国の一つであった。,最も豊かな,最も強い,最も大きい,最も高い,D
モンテ・アルバンは_______に位置し、_______によって建設された。,メキシコの谷、アステカ人,オアハカの谷、サポテカ族,アマゾンの氾濫原、オルメカ人,ユカタン半島、マヤ,B
完新世のアフリカでは、＿＿＿＿は＿＿＿＿＿に取って代わられた。,マイクロリスブレード、バックドブレード,イベロマルス文化、カプサ文化,カプサ文化、イベロマルス文化,マグレモーゼ、ナトゥーフ,B
メソポタミア文明発展の決め手とならなかったものは?,河川近くの耕地から離れて人口を集中させる必要性,階段ピラミッドや神殿などの記念碑的建造物を建設する必要性,運河の建設を可能にする複雑な社会システムを発展させる必要性,十分な食料を生産するための灌漑の使用,A
次の作物のうち、ホープウェルの生存に重要な要素でなかったものはどれか?,ヒマワリ,カボチャ,トウモロコシ,イタドリ,C
象徴的表現としての芸術の明白な証拠は、次のうちどの時代から早くも見つかっているか?,"BP 95,000年、ドルニ・ベストニースにて。","BP 77,000年、ブロンボス洞窟にて。","BP 50,000年、アイオワ州デモインにて。","BP 36,000年、ウォートン・ヒルにて。",B
家屋の壁や防御構造物の建設に使用された、土を踏み固めたり搗いたりする中国の技術とは何か?,版築,甲骨占い,龍山,秦の製造,A
レイクフォレスト・アルカイックの伝統は＿＿＿＿＿＿＿＿資源に頼っていて、マリタイム・アルカイックは＿＿＿＿＿＿＿＿生物を狩猟していた。,外洋性、貝塚,湖成、外洋性,貝塚、沿岸,沿岸性、湖成,B
遺伝学的証拠は、現代のイヌイットがどの民族の子孫であることを示しているか?,パレオ・エスキモー,ドーセット,トゥーレ,クローヴィス,C
解剖学的現代ホモ・サピエンスに関連する道具技術はどれか?,オーリニャック,アシュール,ムステリアン,bとcの両方,A
絶対日付と相対日付の違いは何か?,絶対的な日付は誰でも知っているが、相対的な日付は30年から50年の範囲である。,相対的な日付は放射年代測定技術から導き出されるが、絶対的な日付は文書にのみ関連する。,相対的年代は年または年の範囲を示すが、絶対的年代は年代順を示す。,絶対的な日付は年または年の範囲を示すが、相対的な日付は年代順を示す。,D
ロードアイランドを探検したイタリア人航海者ジョヴァンニ・デ・ヴェラッツァーノは、先住民が次のうちどれに似ていると指摘したか?,イタリア人,アジア人,オーストラリア人,メラネシア人,B
インダス川流域の都市部中心と同様、テオティワカンもまた、次のうちどのようなものであったか?,洗練された配管と冷却システムを備えていた。,伝染病や病気が常に発生していた。,巨大な農業後背地に囲まれていた。,碁盤目状に計画され建設された。,D
メキシコ渓谷の人口は次のうちどのような手段で支えられていたか?,長距離交易、塩の採掘、石積み。,狩猟採集、漁業、根菜類の栽培。,高度な医療技術、職人技術、冶金技術。,農業灌漑、段々畑、チナンパと呼ばれる人工的な盛り土。,D
