ギザのエジプト最大のピラミッドについて正しい記述を次のうちから選べ。,クフ王、クフ王の息子カフレ、クフ王の孫メンカウレの埋葬記念碑として建設された。,旧約聖書の出エジプト記に記述されているように、死の恐怖の下で強制的に働かされた奴隷たちによって建設された。,第6王朝の建設狂乱の中で建設された。,上記すべて。,A
解剖学的に現生人類が初めて中東に到達したとき、彼らは誰に遭遇したか?,ヨーロッパとアジアに生息していた前近代人の進化的子孫であるネアンデルタール人,ヨーロッパとアジアに生息していた前近代人の進化的子孫であるホモ・エレクトス人,アジアで独自の進化を遂げ、20万年前までにそこに到着していたホモ・サピエンス,上記すべて,A
ホーレンシュタイン・シュターデル洞窟の「ライオン・マン」は次のうちどの一例か?,モバイルアート。,エキゾチックな原材料の長距離交易。,洞窟アート。,ヴィーナスの置物。,A
クノッソス宮殿の最盛期には、_________以上の部屋があったと考えられている。,100,500,"1,000","5,000",C
ホープウェルは複雑な階級社会であったが、国家ではなかった。ホープウェル文化に備わっていた要素は、以下のうちどれか?,正式な政府,記念碑的なアースワーク,都市中心部,恒久的な軍隊,B
太陽のワカの泥レンガに見られる印は、次のうちどれと考えられているか?,技術者たちによってそこに書かれた建築業者への指示。,無作為のひっかき傷であり、意味のある文字や書き言葉ではない。,それを作った地元のグループを特定するためのもの。,建築現場で大工たちが行った単純な計算。,C
ストーンヘンジの30個の直立した石は_______と呼ばれ、水平の石は_______である。,マメ、サルセン,まぐさ、石碑,サルセン、まぐさ,トリリトン、円形建造物,C
現代の人間の赤ちゃんの二次的な晩成性の状態は、次のうちどの点で進化的な解決策であったと言えるか?,ヒト科の脳の大きさは100万年以上も成長していなかったため、赤ちゃんが歩くのは困難だった。,それは、より早い年齢での二足歩行と母親からの自立を可能にした。,二足歩行の結果、女性の骨盤の産道が狭くなったため、出生後の脳の成長を可能にした。,二足歩行の結果、女性の骨盤の産道が広くなったため、出生前に脳がほぼ成人の大きさに成長することができた。,C
C3およびC4経路に関する研究は、植物群落の変化が、古代のヒト科の食餌の以下のうちどれからの移行と関連していたことを示しているか?,草を中心とした種から木の実や果実へ。,肉から果物や野菜へ。,果物や野菜から魚へ。,木の実や果物から、より草を中心とした種へ。,D
次のうち、中石器時代における植物の新たな用途を示す証拠はどれか?,南西ヨーロッパのアルタミラ洞窟に見られる、天然の殺虫剤としての種子の使用,南フランスのアウリニャキア人の埋葬に見られる、花などの植物材料,南アフリカのシブドゥ洞窟の床に敷き詰められた植物材料,グラベット人の伝統における、槍投げやカヌーを作るための木材の使用,C
現代のアフリカ人がネアンデルタール人のDNAを持っていないということが示すのは、次のうちどれか?,ネアンデルタール人と解剖学的現生人類の間の遺伝子流動は、ネアンデルタール人がアフリカから移動する前に起こったはず。,ネアンデルタール人と解剖学的現生人類の間の遺伝子流動は、解剖学的現生人類がアフリカから移動した後に起こった。,アフリカに住んでいたネアンデルタール人は解剖学的現生人類と交雑しなかったが、彼らがアフリカから移動する際に一緒に移動したに違いない。,解剖学的現生人類とネアンデルタール人との間には、交雑は起こらなかった。,B
"更新世の終わりにかけて、28,000年前から18,000年前の間、世界の海水面は現在よりはるかに低く、その結果、シベリアの東に______________と呼ばれる陸塊が露出した。この時代は___________と呼ばれている。",ベーリング、後期ベーリング期,スンダランド、マッケンジー最大期,ベーリング、後氷河期最大期,ワラセア、後期ローレンタイド期,C
大規模な土地の改変を特定するのに最も適した考古学的手法はどれか?,テストピット,地中レーダー,航空写真,陽子磁力計,C
最終的に太平洋を移動した文化複合体全体に適用された陶器様式の名称は?,クローヴィス,ネナナ文化複合体,ラピタ,ミクロネシアの陶器の伝統,C
単純採食者と複雑採食者の違いのひとつは?,複雑採食者は灌漑技術を用いる。,複雑採食者は、より幅広い食料源に依存している。,複雑採食者ほど移動性が高い。,複雑採食者は、少数の生産性の高い資源に焦点を当てる。,D
フレールの発見の意義は、彼が発見したものが以下のうちどの場所にあったことか?,絶滅した動物の遺骸の下。,絶滅した動物の遺骸の上、地表にあった。,アフリカの、人類が住んでいたとは誰も思っていなかった地域にあった。,中世の城跡の上。,A
世界で最も古い文字の形式は何か、またそれはどこで発展したか?,楔形文字、メソポタミア,象形文字、エジプト,粘土板、クノッソス,ルーン文字、ストーンヘンジ,A
個人が社会レベルの階層に配置される社会的統合のパターンを次のうちどう呼ぶか?,都市化。,社会システム。,社会階層化。,ネクロポリス。,C
ミノア経済が自然災害に対して特に脆弱であったのは、それが次のうちどれに大きく依存していたからか?,農業,海洋貿易,金属加工,奴隷労働,B
＿＿＿＿＿＿＿は南米最古の王国の一つを発展させ、その最盛期は_______________頃であった。,モチェ、紀元400年,ワリ、紀元100年,インカ、紀元200年,マヤ、紀元400年,A
北極圏で見られる、くさび形コア、マイクロブレード、両面ナイフ、ビュランからなる石器技術の名前は?,クローヴィス文化複合,デナリ文化複合,フォルサム文化複合,ネナナ文化複合,B
現場資材を囲んでいる土を取り除くために使用されるのは、次のうちどれか?,ブラシ,こて,デンタルピック,上記すべて,D
眼窩の上方および眼窩を横切る、連続した骨の隆起を次のうちどう呼ぶか?,矢状稜。,眼窩上隆起。,上顎骨。,後頭骨。,B
チャコ・キャニオンの先祖代々のプエブロ文化は、次のうちどれから構成されていたか?,約75の大規模集落と300以上の小規模コミュニティ。,記念碑的な建築物を持つ500以上の町や村。,30から40の農家と3つの大きなプエブロ。,1つの大きな都市と300以上の郊外の農場。,A
仰韶文化が龍山文化に移行したのは、＿＿＿＿＿以降のことである。,BP 6000年,BP 5000年,BP 4000年,BP 3000年,B
更新世後のヨーロッパの食糧資源基盤の最も顕著な特徴は、次のうちどれか?,巨大動物への依存。,狩猟と採集。,毛皮を持つ動物への依存。,多様性。,D
イスラエルで野生の穀物が収穫され消費されていた証拠は、いつまでさかのぼることができるか。次から選べ。,BP 20000年,BP 12000年,BP 10000年,BP 8000年,A
インダス文明は次のうちどれによって特徴づけられたか?,高度に中央集権化された経済,綿密に計画・設計された都市,標準化された度量衡,上記すべて,D
一説によると、先祖代々プエブロのエリートたちが力を持つようになったのは、ある特定の集団が____________時である。,日食や流星群などの天文現象を予言した,モニュメントや精巧な多層崖住居を建設した,豊作の年に余った食糧を貯蔵し、不作の年に分配した,征服戦争を通じて他の社会を取り込んだ,C
テオティワカンがメキシコ盆地で有名になったのは、そのライバルであったクイクイルコに次のうちどの出来事があった後か?,火山の噴火によって廃墟となった。,支配者一族間の内乱に屈した,農作物が枯れてしまった,メキシコ湾岸のハリケーンによって水没した,A
北西海岸の社会から得られた証拠が示している、社会的複雑性の発展に最終的に必要なものは次のうちどれか?,農業。,灌漑技術。,社会階層化。,食糧余剰。,D
人類にもっとも近い近縁種をよりよく理解することを目的とした人類学のサブフィールドはどれか?,古人類学,考古学,霊長類学,言語学,C
オーリニャックの技術は、ムスティエの技術とどう違うのか?,ムスティエの技術では、より多くの発射点が作られた。,ムスティエの技術は、より多くの使い道のある刃の表面を生産した。,オーリニャックの技術は、より多くの使い道のある刃の表面を生産した。,オーリニャックの技術は手斧の生産に集中していた。,C
次のうち、複雑な社会の証拠はどれか?,記念碑的作品,副葬品を伴う埋葬,余暇と定住生活,上記すべて,A
ホモ・エレクトスの顔は現生人類よりも___________であったが、ホモ・ハビリスよりはそうではなかった。,晩成性,多毛,後頭,下顎前突,D
モンテスマは＿＿＿＿＿＿＿＿の首都＿＿＿＿＿＿＿＿＿からの何百万もの人々を支配した。,マヤ、ティカル,アステカ、テノチティトラン,テオティワカン、テオティワカン,サポテカ、モンテ・アルバン,B
文明の特徴はすべてエジプトなどのある場所で発達し、そこから世界の他の地域に広がっていったという考え方は、次のうち何と呼ばれているか?,文化の進化,移住論,伝播論,反始原主義,C
体格に対する脳の大きさの比率を比較した場合、どの種の脳が相対的に大きいか?,ホモ・エレクトス,前近代のホモ・サピエンス,ネアンデルタール人,現代のホモ・サピエンス,D
殷王朝の王墓は巨大な十字型の墓で構成され、亡くなった王はここに次のうちどれと共に埋葬されたか?,翡翠、青銅、陶磁器の工芸品。,戦車と馬。,生贄となった人間の首のない死体。,上記すべて,D
南アフリカのマラパ洞窟で発見された上記のヒト科動物は次のうち何として分類されているか?,ホモ・ハビリス,アウストラロピテクス・セディバ,ホモ・サピエンス,アウストラロピテクス・ロブストス,B
民族学的証拠は、余剰食糧と社会的複雑さとの間において、次のうちどの関係を裏付けるか?,経済的不平等に必要な余剰食糧を生産できるのは農耕民族だけ。,資源が豊富な環境の中には、経済的不平等と社会の複雑さをもたらす余剰を生み出すことができるものがある。,経済的不平等は社会の複雑さの基盤であり、余剰食糧の生産は完全に農業に依存している。,余剰食糧の生産は、経済的不平等や社会的複雑性の発展において重要ではない。,B
人類の進化において、火を使うことの最大の利点は次のうちどれか?,火は捕食者や敵から身を守る。,火は肉を消化しやすくし、バクテリアを殺す。,火は光と熱を生み出す。,火は戦争や畑の掃除に使える。,B
花粉学は______________の研究であり、科学者は______________を再構築することができる。,有孔虫、木の年輪のマスターシーケンス。,動物のふん石、古病理学と性的二型性。,花粉、植物群落と気候。,植物化石、人工淘汰と光合成経路。,C
オルメカ文化の統一要素は何か?,宗教的図像,大軍,農業余剰,上記すべて,A
次の古代文明のうち、最も解読が遅れている文字言語を持つのはどれか?,インダス,エジプト,メソポタミア,中国,A
南アフリカのピナクル・ポイント遺跡における高度な石器製作産業は、次のうちどれの証拠か?,25万年前の伝統的な手斧の生産と使用。,"7万1,000年前の複雑なマイクロブレードの生産と使用の流れ。",寒い環境での狩猟への適応。,AとCの両方。,B
マヤの社会が複雑であった初期の証拠は、BP2650年ごろ出現した次のうちどれの出現によって示唆されるか?,精巧な彫刻が施された黒曜石の彫像。,装飾された階段状の台。,チョコレートのメソアメリカ経済への導入。,敗者が神々の生け贄に捧げられる儀式的なボールゲーム。,B
人類学者が、シベリアからアメリカ大陸に人が入ってきた時期を特定するために知る必要のないことは?,ソリ犬が最初に家畜化された時期,ベーリング海峡が露出して旅行に開放されたとき,東シベリアに初めて人が住み始めた時期,最も古い新世界遺跡の年代,A
アボリジニがオーストラリアの過酷な内陸部を占領したのはいつか?,"10,000～12,000年前","20,000～25,000年前","35,000～40,000年前","40,000～45,000年前",B
メソポタミアのハッスナン遺跡とサマラン遺跡の共通点は?,どちらも農業に大きく依存していた。,どちらも珍しい贅沢品が豊富にある。,どちらも格式の高い埋葬をする。,どちらも洗練されたモニュメント建築がある。,A
南米がヨーロッパに農業的に最も貢献した作物は?,米,ジャガイモ,カボチャ,豆類,B
中石器時代の交易パターンと後期旧石器時代の交易パターンの違いは何か?,中石器時代には、物品はより遠くまで運ばれ、より多くの物品が交換された,中石器時代には、物品はより遠くまで運ばれたが、交換された物品はより少なかった,中石器時代には、物品はより遠くまで運ばれなかったが、交換された物品はより多かった,中石器時代には、物品はより遠くまで運ばれず、交換された物品はより少なかった,C
富の再分配が行われる祭典を次のうち何と呼ぶか?,ポトラッチ,キバ・パーティー,トーテムの祝宴,シナグア,A
微量元素分析の技術は次のうちどれか?,陽子磁力計と電気比抵抗,加速器質量分光分析と光合成経路,炭素同位体分析と実験的複製,中性子放射化分析と蛍光X線,D
焼いた動物の骨を調べることによって未来を占う中国の方法は、次のうちどのように呼ばれているか?,版築,サラセン占い,甲骨占い,円筒印章の予言,C
考古学者たちは、オルメカ人が建設した記念碑をどのように特徴づけてきたか?,ハラフの祭祀遺跡,巨石首長都市,余剰食料貯蔵センター,王の儀式センター,D
北米先住民の先祖の遺骨がある遺跡で考古学的調査を行うことの倫理は、アメリカ先住民の墓の保護と送還法によって扱われている。しばしば問題が生じるのは次のうちどの場合か?,非先住民の考古学者とアメリカ先住民の両方が同時に遺跡に立ち入ることを許可されている。,考古学者としての訓練を受けたアメリカ先住民がおらず、アメリカ先住民である考古学者もいない。,考古学者もアメリカ先住民も、遺跡の正確な埋葬場所について同意できない。,埋葬があまりにも古いため、現代の生きている人々のグループとの歴史的または系図的なつながりを確立することが不可能。,D
以前は神殿墳墓を築いた人々として知られ、トウモロコシとカボチャの農耕を主な生活基盤としていた文化はどれか?,古代プエブロ人,ホホカム,ミシシッピ,アデナ,C
ウルクの都市、マヤとモチェの文化はすべて、次のうちどれによって悪影響を受けたか?,侵略,干ばつ,内戦,地震,B
トウモロコシの野生原種は何か?,ヒトツブコムギ,エンマ,テオシント,マメ科植物,C
中期旧石器時代と比較すると、後期旧石器時代の道具技術は＿＿＿＿＿＿＿＿。,刃物よりも薄片を重視した,急速に変化した,核となる道具を入念に準備する必要があった。,上記すべて。,B
ネアンデルタール人と現生人類集団の最近のゲノム解析が示すことを次から選べ。,ヨーロッパやアジアに祖先を持つ現生人類のゲノムの1％から4％は、ネアンデルタール人集団から発生したものであり、交雑によって発生した可能性が高い。,ネアンデルタール人の集団は、解剖学的に現生人類とは全く別個の存在であり、交雑の証拠はない。,世界中の解剖学的に現生人類は、ゲノムの約16％をネアンデルタール人と一様に共有している。,現代のアフリカ人はゲノムの4％以上をネアンデルタール人と共有しているが、これは現代のヨーロッパ人やアジア人の集団よりもはるかに多く、交雑が成功した期間がより長かったことを示している。,A
次のうち、遺跡で使用されるリモートセンシング装置はどれか?,地中レーダー,陽子磁力計,電気比抵抗,上記すべて,D
ジャポニカ米（短粒種）とインディカ米（長粒種）という2つのコメの主要品種の遺伝学的研究から、次のうちどれが示唆されているか?,それぞれの品種は現地の野生原種よりも互いに近縁であり、これらのコメの近代品種が東アジアで最近開発されたことを示唆している。,それぞれは、互いよりも現地の野生原種により近縁であることから、これらのコメの現代品種は東アジアと南アジアで別々に栽培化されたことが示唆される。,それぞれは互いに無関係であり、これらのコメの現代品種は東アジアと西ヨーロッパで別々に栽培化されたことを示唆している。,"それぞれがその地域の野生の祖先と近縁であることから、栽培化が起こったのはごく最近のことで、2,000年前より前ではないことが示唆される。",B
サンギルで子供たちと一緒に埋葬された副葬品の量は何を示しているか?,この部族はほとんどの時間をビーズの彫刻に費やしていた。,この部族は複雑な交易ネットワークに関与していた。,この部族は複雑な社会的地位の継承システムを持っていた。,子供たちが部族のリーダーであったこともある。,C
最盛期のテオティワカン市の人口は次のうちどれに達したと思われるか?,5万人。,20万人,50万人,100万人,B
ヌビア文明は、＿＿＿＿＿＿＿＿＿＿＿＿＿。,エジプト文化の勃興に先駆け、拍車をかけた,南部メソポタミアの植民地化の結果,エジプト文化の模倣ではなく、それに呼応して発展した,近隣文化との接触はなかった,C
下顔面が前方に突き出していることを次のうち何と呼ぶか?,樹上性,突顎性,正中離開,下顎,B
古代プエブロ人がメサ・ヴェルデを放棄した原因は何か?,人口が環境の生産能力を上回った,干ばつ,新しい宗教に惹かれて南部に移住した,上記すべて,D
石器の製作と使用に最初に関連する最も典型的な種は次のうちどれか?,ホモ・ハビリス,アルディピテクス・ラミドゥス,ホモ・サピエンス,アウストラロピテクス・ロブストス,A
岩肌に描かれた絵ではなく、岩肌に刻まれた図柄を次のうちどう呼ぶか?,象形文字,ペトログリフ,絵画,石化,B
"テキサス州の中南部にあるゴールト遺跡からは、13,000年前のパレオ・インディアンがこの場所を選んだという証拠が見つかっている。それは次のうちどれか?",遺跡が航行可能な川やメキシコ湾岸に近いこと。,豊かで多様な森林地帯の環境の中で、野生の獲物、植物、魚が豊富に生息していたこと。,採石や石器製作に使われるチャートのその土地の産地が近くにあること。,バイソンなどの大型哺乳類の移動ルートが近くにある。,C
中石器時代初期のマグレモーゼ文化は、次のうちどの環境に適応していたか?,ツンドラの環境,砂漠環境,森林と湖畔の環境,赤道直下の環境,C
南米で最初の金属はどのように加工されたか?,鋳造,鍛造,製錬,上記すべて,B
3万年以上前にヨーロッパで開発された槍投げの道具をアステカ語で何というか?,チュンキー,アトラトル,ビュラン,ペトログリフ,B
人間による動植物の指向性繁殖を次のうちどう呼ぶか?,採食,人工淘汰,自然淘汰,群れ,B
興味深いことに、古代南米の文明がどれも発達させなかったのは次のうちどれか?,記念碑的作品,灌漑技術,書き言葉,大規模な軍隊,C
次のうち、ヒト科動物が二足歩行をした理由の仮説に当てはまらないものはどれか?,両手が自由になり、物を運べるようになった,脳頭蓋の拡張が可能になった,長い距離を移動するのに、四足歩行よりも少ないエネルギーですむようになった,ヒト科動物がより遠くを見ることができるようになった,B
エジプトで最初のファラオが誕生したのはいつ?,BP 3100年,BP 4100年,BP 5100年,BP 6100年,C
ホホカム人がメソアメリカ文化からどの習慣を取り入れた証拠があるか?,トウモロコシビールの儀式的消費,儀式的な人身御供,儀式的な球技,階段ピラミッドの建設,C
インカがこれほど多くの戦争を行った理由のひとつとして考えにくいものは、次のうちどれか?,力強い叙事詩のストーリーラインを展開するため。,才能ある指導者を特定し、育成するため。,若い男性人口を一定の割合で殺し、革命を防ぐため。,戦争の神々を鎮めるため。,B
テオティワカンという名前は次のうち誰によってこの都市に与えられたか?,アステカ人、その都市が崩壊した後もずっと巡礼を続けていた。,スペイン侵略軍、軍の侵略により都市の大部分が破壊された。,この都市の初代王、自分の好きな神にちなんで名づけた。,オルメカの商人たち、その壮大さに感銘を受けた。,A
上記の祭典を主催したのはどの文化か?,南西部砂漠の古代プエブロ人,南西部山地のモゴロン人,太平洋北西部のクワキウトル人,アメリカ中西部のホープウェル人,C
次のうち、複雑な社会が発達した最も古い例はどれか?,イスラエルのエリコ,ペルーのカラル,イギリスのストーンヘンジ,メキシコ湾岸のオルメカ,A
猫の家畜化に関する考古学的証拠が示す家畜化の始まった時期と理由は以下のうちどれか?,"2万2,000年前より以前。日和見狩猟採集から物流的採集へのシフトの結果として","1万1,000年前より以前。人工淘汰の直接的な結果として","1万1,000年前以降。食料生産と貯蔵の意図しない結果として","9,000年前以降。牛の家畜化と牛乳とチーズの生産の意図しない結果として",C
古代国家社会の最も明白な物質的象徴は、次のうちどれか?,石板,ピラミッド,記念碑的作品,灌漑用水路,C
インダス川流域の都市と古代メソポタミアの都市国家が交易をしていた証拠は?,両地域の遺跡から黒曜石の道具が発見されている。,メソポタミアのガラスビーズ、銅、金がインダス川流域のハラッパー遺跡で発見されている。,メソポタミアではハラッパーの印章が、インダス川流域ではメソポタミアの円筒印章が見つかっている。,上記のすべて。,C
中新世の終わりに、多くの猿の種が絶滅したのは次のうちどの理由からか?,人類が殺した。,ユカタン半島に小惑星が衝突した。,環境の変化。,恐竜に食べられた。,C
