都市社会学への生態学的アプローチは、次のうちどれに関する研究を含んでいたか?,社会集団がどのように都市のさまざまな地域を植民地化し、資源を奪い合ったか,都市の隅で見られる野生生物や自然の生息地の形態,人々が環境問題について集団的な抗議を組織した方法,男女がどのように都市の公共空間を使い分けていたか,A
ベッカーは、大麻の使用は次のうちどのようなものだと主張したか?,1970年代、若者のあらゆる層で増加していた,逸脱したキャリアの社会的プロセスを通じて徐々に学んだ,若者に追及させるべきではない危険な嗜好品,他の社会学者が示唆したほど楽しいものではなかった,B
19世紀に発展した中産階級は以下のうちどのようなものだったか?,都市に住み、市民団体や任意団体に関与していた,多様性に富んでいたため、強い階級意識を持つことができなかった,「ホワイトカラー」の仕事に携わることが多かった,上記のすべて,D
監視の技術的形態により、容易になったのは次のうちどれか?,消費者に関する「個人」情報へのアクセスと交換,電子タグの使用による刑務所の過密状態の緩和,職場における従業員の活動の監視,上記のすべて,D
フェルディナント・テンニエスが開発したゲマインシャフトという概念は、基本的に＿＿＿＿＿と同じ関係特性を表す。,有機的連帯,機械的連帯,ゲゼルシャフト,アノミー,B
1980年代に所得格差が拡大したのはなぜか?,所得税の税率がすべての職業グループに対して等しく上昇した,専門職は増えたが、それに見合う人材が不足していた,消費財の価格が収益よりも高い割合で上昇した,失業者数の増加により、福祉給付金に依存する人が増えた,D
逸脱した行為が「正常化」された場合、それは次のうちどのようになるか?,重要な行動規範を破るものとして認識される,そうでなければ「正常」な性格からの一時的な逸脱とみなされる,逸脱した経歴を確立するための第一歩となる,その人の遺伝的または解剖学的構成に起因する,B
「経営者革命」に関する議論の中で、ジョン・スコット（1997）は次のうちどのように主張したか?,オーナーは依然として、株主グループや兼任取締役を通じて支配権を行使している,所有と経営は、ますます別々の機能になってきている,科学的経営の手法は、過度に官僚的で非効率的,経営者は労働条件に不満を持つようになり、企業オーナーの打倒を目論むようになった,A
マルクス主義フェミニストは家父長制を以下どの観点から説明するか?,男女の権利と機会の平等の欠如,男性が女性を経済的、政治的、性的に抑圧する性的階級,資本主義経済によって搾取される女性の家事労働,資本主義と男性支配の二重体制,C
次のうち、ギデンズ（1998）が新労働党の「第三の道」の一部として定義していないものはどれか?,家族の民主化,民営化に終止符を打つ,積極的な福祉：「恵んでもらうために手を差し伸べるのではなく、働くために手を挙げよ」,市民社会の強化,B
レインやエスターソンのような反精神科医は、次のうちどのように考えていたか?,精神医学は時代遅れの治療法であり、アロマセラピーやキネシオロジーのような代替療法に取って代わられるべき,精神疾患は元来生物学的なものであり、患者が経験する「心」を研究することに意味はない,精神科医は資本主義の代理人であり、患者に支配階級のイデオロギーを植え付けようとしている,奇異に見える行動は、家族の相互作用のパターンが乱れていることに対する合理的な反応であると考えられる,D
バトラーとストークス（1969）は、労働者階級の労働党支持は以下のうちどれから生じると示唆したか?,労働者階級の家族やコミュニティへの社会化,自己利益の合理的計算,文化やライフスタイルに関する問題に基づく懸念,誤った意識と覇権的価値観の受容,A
現代社会において、社会制度とは次のうちどれか?,高度に専門化され、相互に関連し合う社会的慣習の集合,ポストモダン世界における無秩序な社会関係,サイバースペースにおけるバーチャル・コミュニティ,もはや社会学とは無関係なもの,A
「感情労働」(ホックシールド 1983)という用語は、次のうちどれを指すか?,公共の場での相互作用に適していると考えられる感情を意識的に管理し、提示するために用いられる技術,心理学者、カウンセラー、セラピストが、精神的および感情的な問題を抱えるクライアントを支援するために行う仕事,悲嘆や恋に落ちるなど、人から多くの感情的なエネルギーを必要とする経験,リスクと不安のレベルが高まるにつれて、私たちは自分のアイデンティティについてより反射的に考えるようになった,A
社会学者が社会の階層構造とその間の人々の移動を研究するとき、彼らはこれを次のうちどう呼ぶか?,社会階層,社会的統制,社会的対立,社会的連帯,A
ウェーバーが特定した社会的行為の4つの理念型は次の通りである：手段合理的、価値合理的、伝統的、そして、次のうちどれか?,感情的,情動的,効果的,感染性,A
エクレシアとは何か?,会員に対する完全な精神的権威を主張する宗教組織,強制的な会員ではなく、自発的な会員を中心に組織された教会,非常に少数の信者を持つ宗派またはカルト,司祭または他の精神的指導者の階層,A
米国と大英帝国において奴隷制度が廃止された後、政策立案者はこれらの都市に移住する元奴隷が経験するであろうことを次のうちどれと主張したか?,同化,適応,差別,補償,A
サザーランドによる「職業的窃盗犯」の研究は、次のうちどれを示唆しているか?,人は犯罪を肯定的に定義する他人と付き合うことで、犯罪生活に社会化される,犯罪の大半は、専門的な職業に就く中産階級の人々によるもの,窃盗で逮捕・起訴された人々は、自分たちを窃盗犯だとは定義していない,路上で最も危険な犯罪者は、高度な技術を持つ窃盗犯,A
新労働党政権が追求しなかった政策は次のうちどれか?,生徒の能力による配置とクラス編成,保護者による学校選択,失敗していると思われるLEAへの支援,国家によるカリキュラムの規制と管理,C
ストーンの調査によると、工業化以前には核家族は＿＿＿＿＿＿＿。,どのような形でも存在しなかった,血縁の拡大されたネットワークがより重要になるにつれ、消滅し始めていた,仕事と家庭生活の分離を通じて出現し始めていた,家父長的支配の単なる制度のひとつであった,C
地方、郊外、都市の発展と移動のパターンに関する統計は、ほとんどの場合、常に大都市統計地域（MSA）と呼ばれる地理的エリアに基づいて報告される。MSAの構成要素とは何か?,米国内の10大都市のみを含む。,MSAは、少なくとも人口5万人以上の中心都市1つ以上で構成され、密集して都市化した郡を取り囲んでいる。,一年のうち少なくとも50％は強い嵐に見舞われる地域。,人口100万人以上の大都市で、郊外に近隣を囲まれている。,B
モスカとパレートは支配エリートを次のうちどのように特定したか?,政治的権威の上位をすべて占める少数集団,特定の技能や能力を持つ社会勢力の連合体,高い地位の間を行き来し、他を排除する集団,上記のすべて,D
ブルデューは階級の再生産を次のうちどれに起因すると考えているか?,資本のカルト,資本文化,文化資本,犯罪的占拠,C
世俗化には次のうちどの2つの関連した考え方があるか?,失望と不均衡,不信と崩壊,離脱と幻滅,分配と蒸留,C
一般出生率が1964年から2000年の間に低下したのは、以下のうちどの理由によるか?,結婚年齢と出産開始年齢の上昇,出産適齢期の女性が今世紀前半より少ない,出生率の測定と統計作成の誤り,貧困、劣悪な住宅、劣悪な衛生環境による病気のリスク,A
ハワードの田園都市構想は以下のうちどれからなるか?,緑地帯に囲まれた6つの小さな町を、より大きな中心都市につなげる,木々や花々、公共の庭園を多く持つ都市を計画する,個人所有の各戸に、それぞれの前庭と裏庭を持たせる,高層ビルで人口を垂直方向に移動させ、土地の大部分を緑のオープンスペースとして残す,A
人生の「第3の年齢」は、次のうちどれを含むと言われているか?,退職後の積極的な非就労と自立,フルタイムでの就労、家族形成、成人としての責任,病気、孤立、他者への依存の増大,教育から就労への移行、特徴的な若者文化,A
ウェーバー（1919）は、国家が武力行使を独占することは、次のうちどれによって正当化されると述べたか?,カリスマ的権威,合理的-法的権威,伝統的権威,価値-合理的権威,B
サリヴァン（2000）の研究によると、男性が家事をする割合が最も多かった時期は次のうちどれか?,「新しい男性」としての自分を再発見したとき,妻が家にいて、いつも口うるさかったとき,フーバーや電気アイロンのようなエキサイティングな小道具が発明されたとき,失業中であったか、パートナーがともにフルタイムで働いていたとき,D
離婚後の親権者から共同親権者への移行が意味するのは、次のうちどれか?,父親が子どもの生活から不在になる可能性が高くなる,一方の親が子どもの福祉と社会化について全責任を負う,両方の親が子どもの継続的な世話をするために協力することが期待される,両親はすべての子どもを平等に養育しなければならない,C
エミール・デュルケームは、社会学の主要な焦点は次のうちどれであると考えたか?,社会的行為,社会的事実,階級関係,文化的力学,B
「社会学」という言葉は、1800年代初頭に次のうちどれによって作られたか?,オーギュスト・コント,ロバート・K・マートン,カール・マルクス,エミール・デュルケーム,A
ブラウンとハリス(1978)はうつ病の研究で次のうちどれを発見したか?,ストレスに対する女性の感受性は、社会的支援のレベルに依存する,自己申告によるうつ病は、男性と比較的裕福な人の間で最も高い,診断されたうつ病のレベルは、男女ともほぼ同じ,従来の性別役割のため、男性はうつ病にかかりやすい,A
「ネットワーク組織」の代替形態とは、以下のうちどれを指すか?,仕事は独立したサプライヤーや小売業者に下請けに出すことができる,商取引は電子コミュニケーションを通じてのみ行われる,柔軟な役割分担の横のネットワークを通じて、日本型モデルが適用される,活動は男女間で平等に再配分される,A
マーガレット・ミードが示唆したのは次のうちどれか?,青年期と性別役割分担は社会によって異なるため、文化的に決定されたもの,ニューギニアの3つの社会における性別役割分担は同一であったため、生物学的に決定されたはず,アメリカの青年期は、日本やヨーロッパでの経験に比べ、相対的に穏やかな時期,人類学のフィールドワークは、研究者の価値観が観察結果の解釈方法に影響するため、問題が生じることがある,A
「二次的逸脱」とは次のうちどれを指すか?,逸脱行為に対する罰や汚名,ある行為に対する社会的反応を通じて、逸脱行為のレッテルを貼ること,逸脱的役割を担うことが、将来の行動に影響を与える方法,上記のすべて,D
インターネットが公共圏に及ぼした影響は以下のうちどれか?,エリート集団の利益のみを促進することで、公共圏を抑圧する,言論の自由へのコミットメントを再確認することで、公共圏を復活させる,仲間集団との対面での接触を重視することで、公共圏を再生産する,より優れたコミュニケーション形態に置き換える,B
ウェーバーは、「資本主義の精神」は＿＿＿＿＿＿＿に遡ることができると述べた。,宗教的多元主義への運動,宗教的思想を復活させたプロテスタントの鼓舞的なグループ,伝統的な労働形態を否定した新しい宗教運動,救いの印を得るために苦行に従事したカルヴァン主義者,D
「1970年代の危機」という用語は、次のうちどれを指すために使用されるか?,利益の減少と失業率の増加,福祉国家の根絶,離婚率の上昇と伝統的家族の衰退,ファッション感覚の不運なゆがみ,A
マクファーソン報告は、以下のうちどの問題が増加していることを強調したか?,ヘイトクライム：単に人種を理由とする少数民族に対する暴力,制度的人種差別：社会制度の日常や慣行に組み込まれた体系的な不利益の形態,制度改革によって取り組まなければならない警察におけるあからさまな人種差別,長期的な宿泊施設を必要とする亡命希望者の増加,B
バス停でバスを待っている7人が黙って立っているのは、次のうちどの例か?,一次グループ,二次グループ,集合体,社会的カテゴリー,C
環境保護主義的な社会運動は、次のうちどのような意味でグローバルか?,地球全体に影響を及ぼすリスクに対する我々の認識を高める,彼らは普遍的な価値と人権に訴える,彼らは世界的なメディアを使って話題を呼ぶ,上記のすべて,D
チョドロウ（1978）は、ジェンダーの社会化は次のうちどのような形で起こると主張したか?,男児も女児も母親に強く密着するが、男児は離反する,女児は母親に密着するが、離反する,男児は父親に、女児は母親に密着する,男児も女児も父親に強く密着するが、女児は離反する,A
1980年代の「新しい男」は次のうちどれと言われているか?,繊細で、思いやりがあり、感情的,子どもじみて、攻撃的で、暴力的,強く、頼りになる稼ぎ手,バイセクシャルであることを公言し、それを誇りに思っている,A
1960年代、総合制中等学校は教育における階級間の不平等を根絶することはできなかった。原因は次のうちどれか?,総合制中等学校は、都心部や伝統的に労働者階級の地域から生徒を採用する傾向があった,選抜制の学校は、依然として最も能力の高い生徒を「吸い上げる」することができたが、総合学校は、子どもたちを能力別編成クラスに入れた,総合制中等学校の教師は、教室で制限された規範を用いたが、労働者階級の生徒たちは、精巧な会話規範を用いた,全国的なテストとリーグテーブルによって、新しい学校は非常に競争的で選別的なものとなった,B
科学の理想化された見方では、実験方法は以下のうちどれを含むと言われているか?,新しい研究方法を試して、どれが最も効果的かを調べる,ある変数が別の変数に及ぼす影響を分離して測定すること,何を研究するかを決めるために個人的な信念と価値観を用いること,データを主観的に解釈し、理論的パラダイムを利用する,B
「開かれた」社会とはどんな社会か?,すべての構成員に平等な地位を与える,政府に公の秘密がない,性的な行動に対して寛容な態度をとる,階層間の移動を認める,D
ネーション・オブ・イスラムは次のうちどのような人々にアピールしたか?,アジア亜大陸からのイギリス生まれの第二世代移民,イスラム教への改宗を望む白人アメリカ人,アメリカの「人種のるつぼ」から排除されていると感じていたアフリカ系アメリカ人,都心部に住み、独特の若者文化を持っていたアフリカ系カリブ人,C
コントの「実証主義」という言葉は、次のうちどれを意味するか?,社会の肯定的側面を強調する理論,観察可能な現象の正確で科学的な研究,難問を提起し、それに答えようとする理論,社会の進歩に関する非科学的な一連の法則,B
人種差別的言説の理論が示唆しているのは次のうちどれか?,人種とは、生物学的根拠に基づいて人々を分類する客観的な方法,人種という概念は、強力なイデオロギーによって社会的に構築される,イギリスとアメリカの人種関係は、植民地時代にまでさかのぼることができる,人々は自分の人種的アイデンティティを選択し、それが固定化される,B
大きな自動車事故が発生。一人の男が車を止め、人々を助け始める。彼が車を止めたのを見て、他の人たちも車を止めて人助けを始める。このシナリオを最もよく説明する理論は次のうちどれか?,収束,創発規範,伝染,付加価値,B
新しい高速道路が大都市から農地として使われている地域を横切って伸びている。その結果、最も起こりそうなことは次のうちどれか?,農家は生産面積を増やす。,都市は複数の核を持つモデルに進化する。,都市への通勤時間が短縮されたため、郊外化が進む。,田舎の人々が都市に移り住み、農地地域が過疎化する。,C
W.E.B.デュボワによれば、奴隷制度の余波におけるアフリカ系アメリカ人の進歩は次のうちどれか?,最も優秀な白人アメリカ人が受けることができたのと同じような徹底的で広範な教育を受ける少数のアフリカ系アメリカ人のグループに依存していた,1800年代後半に新しい技能を学ぶことを強いられるのではなく、農業、家事、農村生活の労働からすでに持っていた技能を活用することを含んでいた,すぐに自給自足できるように、職人やサービス業従事者として訓練され、準備されることが必要だった,政府、宗教、教育において対等に受け入れられる大都市に移住することが必要だった,A
多元主義理論が示唆しているのは次のうちどれか?,国家権力は、いくつかの異なる行政機構を通じて行使される,支配エリートは、さまざまな階級的背景を持つ人々で構成される,政党は、有権者の「消費者」の票をめぐって競争しなければならない,階級的背景と政党の選好の間には密接な関係がある,C
「過度の都市化」が意味するのは次のうちどれか?,西欧の近代都市での生活は、第三世界のそれとはあまりにもかけ離れているため、これらの社会を理解することが難しい,貧しい国々では、急速に発展する都市が農村部から資源を流出させている,都市化が開発に及ぼす影響の程度が誇張されている,政府は欧米の都市化に気を取られ、第三世界の問題に目を向けることを忘れている,B
20世紀半ばの資本家階級が上流階級の仲間入りをしたと言われるのは、次のうちどの理由からか?,「社交カレンダー」と同じ余暇の楽しみや行事に参加した,伝統的な貴族のライフスタイルや文化的価値観を模倣した,会社や金融資産を所有し、企業を通じて富を生み出した,物的資産として土地や事業を直接、個人的に所有していた,C
世代間の移動とは、次のうちどれを指すか?,人の生涯にわたる異なる職業カテゴリーへの移動,世代間の異なる職業カテゴリーへの移動,より高い職業カテゴリーへの移動,収入の少ない職業への転職,B
フランクフルト学派のメンバーによって使われた「文化産業」という言葉が指すのは次のうちどれか?,新しいテクノロジーによる文化のグローバル化,文化的商品が利益のために売買される方法,社会におけるサブカルチャーとカウンターカルチャーの発展,工業化が新しいコミュニケーション手段を生み出した方法,B
"ハキム (1995, 1996)によれば、パートタイム労働の大半は女性によるものである。原因は次のうちどれか?",パートタイム労働は比較的賃金が高く、経済的に有益,「家庭中心」の生活と雇用を両立させるために、合理的な選択をする,育児をする余裕がないなど、構造的な要因によって選択が制約される,参入したい職種にフルタイムの仕事がない,B
宗派とは、次のうちどれを中心に組織されているか?,会員が挑戦できる信念、カリスマ的指導者、新入会員に対する開放性,他の宗教に対する寛容さ、政教分離,自発的なメンバーシップ、民主的指導者、高いレベルの感情的コミットメント,世俗的世界そのものが神聖であるという考え,C
私たちがアイデンティティの感覚を獲得し、社会の一員となるプロセスの名を何と呼ぶか?,合理化,植民地化,マクドナルド化,社会化,D
アンケートの事前テストは次のうちどれに役立つか?,どのトピックが回答者にとって重要かの特定,コンピュータとプリンターをテストする,質問の文言やルーティングの問題を特定する,最終サンプルから除外する回答者を決定する,C
ジュディス・バトラー（1999）が示唆したのは次のうちどれか?,性的特徴はジェンダーの生物学的決定要因,異性愛と同性愛は本質的で相反するアイデンティティ,18世紀に「一性」モデルに取って代わった「二性」モデル,ジェンダーは「性」を作り出すために身体的身振りやスタイルを通して演じられる,D
イギリスにおける薬物使用のパターンが明らかにするのは次のうちどれか?,麻薬の使用は増加し、もはや快楽主義的な若者のサブカルチャーに限定されていない,最も一般的に使用されている娯楽用のドラッグはエクスタシー,10代の女子は10代の男子よりもハードドラッグを試す傾向が強い,一連のモラル・パニックにもかかわらず、違法薬物の使用は非常にまれ,A
マレーは、「底辺層」とは以下のうちどのような人々だと考えていたか?,知能レベルが低く、劣った「人種」を形成している,犯罪やみすぼらしさにまみれ、道徳的に不健全な生活を送っている,福祉給付に頼りすぎている,上記のすべて,D
ノルウェー国教会、イスラム教、英国国教会、ギリシャ国教会などの宗教団体に共通する特徴は次のうちどれか?,教会であると同時に文化。,政教分離を実践している。,女性を聖職者として排除している。,一神教である。,D
"ある研究者がある労働組合の組合員に1,000通のアンケートを郵送し、300通の返送を受けた。アンケートを返送した人のほとんどは、労働組合に不満があると答えた。返送されたアンケートだけに基づく結果は、以下のうちどれによって汚染されている可能性が最も高いか?",回答率のバイアス,研究者のバイアス,相関関係と因果関係の混同,統計的回帰,A
役割学習理論が示唆するのは次のうちどれか?,私たちは既存の枠組みから社会的役割を内面化し、引き受ける,私たちは他者との相互作用を通じて役割を創造し、交渉する,社会的役割は固定的・安定的なものではなく、流動的で多元的なもの,無意識の動機を抑制するために、役割を学習しなければならない,A
ポストモダニストの作家たちが主張しているのは次のうちどれか?,私たちは表面的で断片的なイメージの世界に住んでいる,どんな理論も他の理論より優れているわけではない:「何でもあり」,社会は変化し、我々は新しい種類の理論が必要,上記のすべて,A
