リロイは、主にアフリカ系アメリカ人の労働者階級の地域に住む両親を訪ねた。訪問中、彼はコミュニティが変わりつつあることに気づく。一戸建て住宅を提供するための開発がなされ、高級ショッピングセンターもできた。リロイはこうした変化を評価する一方で、物件の価値が上昇しているため、両親がこの地域に住み続ける余裕がなくなるのではないかと心配している。リロイの昔なじみの地域に何が起きているかを説明するのに最も適切なものは次のうちどれか?,中産階級化,都市化,白人の移動,人口転換,A
ワーナーがアメリカ深南部のナチェズ市を調査した結果、そこでは「カラーライン」が＿＿＿＿＿＿ことがわかった。,もはや人種関係に強力な影響を与えるものではない,黒人の住居スペースが少なくなるように土地を区画する方法だった,黒人と白人のグループを同化させるために導入された新しい政策だった,白人の優越性に対する信念に裏打ちされた、黒人と白人のカーストの間の鋭い区分だった,D
幼年期の社会的構造は、以下のうちどれに遡ることができるか?,義務教育の導入,親と子どもとの感情的な結びつきの強まり,衣服、玩具、本など、子ども向けの新しい消費財,上記のすべて,D
マルクスの理論において「生産様式」が意味するのは次のうちどれか?,工場における製品の製造方法,資本主義のもとでの生産性の平均的尺度,社会の技術的・人的資源の組織,社会の上部構造の不可欠な部分,C
受刑者削減政策の傾向に含まれるのは次のうちどれか?,投獄や施設でのケアに代わる地域社会の選択肢,刑罰の主な形態としての投獄の増加,刑務所の管理を民間企業に移管,資本の流動性による分権化された組織,A
スマートの研究が示唆したのは次のうちどれか?,暴力犯罪の発生率は男女で同程度であった,女性の性的非行は男性よりも常態化しやすかった,女性の犯罪行動は伝統的な性別役割分担を反映する傾向があった,上記のすべて,C
アレン(2001)の看護師に関する研究で示されたのは次のうちどれか?,看護師は、報酬を得られない多くの感情的労働を行っている,プロジェクト2000の方針は、看護師のキャリアを非専門化する効果があった,看護職に転身する男性が増えたことで、この職業に対する一般的な固定観念に異議を唱えている,看護師の役割は曖昧であり、他のスタッフや患者との日常的なやり取りの中で、常に再定義されなければならない,D
ある社会が抱える問題の責任を、ある特定の集団に押し付けることを最もよく表しているのは、次のうちどれか?,民族中心主義,ステレオタイプ化,責任転嫁,制度化,C
ダーレンドルフ、レックス、ハーバーマスが注目したのは、以下のうちどの点においてか?,社会的連帯と結束,行為の解釈的理解,女性の経験と性差に基づいた知識,権力、支配、紛争,D
Sreberny Mohammadi(1996)は、国の文化は、以下のうちどの方法で、アメリカ文化のメディア支配に抵抗することができると主張しているか?,より多くの「国産の」プログラムを含むコンテンツの国内化,衛星アンテナを禁止して輸入製品の流通を規制すること,彼ら自身のプログラムの帝国社会への「逆流」を生み出すこと,上記のすべて,D
マルホランド（1998）は、民営化によって企業と経営者の関係は次のうちどのように変化したと主張したか?,日々の詳細なワークシートが導入されたため、柔軟性が低下した,生産プロセスに関して、経営者よりも国家のコントロールが強まった,所有権が小口株主から上級管理職に移った,雇用が信頼やコミットメントよりも業績に左右された,D
次のうち、ジェンダーの役割と職場の分野で実施された現在の研究結果と一致するものはどれか?,子どものいる家庭の約4分の1では、妻が働けるように男性が子どもと家にいる。,ほとんどの女性は、キャリアの選択、昇進、収入において、現在では男女間に平等な機会があると信じている。,男性の方が収入が多いので、女性は専業主婦になるべきだと思っている男性が多い。,働く女性と結婚した男性のほとんどは、家事や育児の義務を働く妻と平等に分担していない。,D
社会化とはどういうことか?,乳児とその養育者との間に愛着の絆が形成されること,社会的原因という観点からすべてを説明しようとする社会理論家の傾向,社会の規範や価値観を学ぶことによって、社会の一員となる過程,社会が伝統的なものから近代的なものへと変化する歴史的過程,C
「資産」という用語が示すのは、次のうちどれか?,貧しい人を相対的に貧しいと感じさせる文化的に価値のある商品と生活水準,人が給料または賃金から受け取るお金の流れ,土地、株式、銀行預金を含む経済資源のストック,異なる量の富を所有する人口の「一部」,C
伝統的な地位と優先順位の階層では、これらの上流階級のメンバーのうち、(最高の地位から最低の地位へ)正しい順序にあるのは次のうちどれか?,首相、ヨーク大司教、イングランド子爵,イングランド侯爵、英国伯爵、国王兄弟,エスクワイア、上級法定弁護士、公爵の長男,国王の孫、大蔵卿、浴室仲間,D
社会規範とは＿＿＿＿＿＿である。,園芸、料理、工芸などの創造的活動,マスメディアにおける社会集団の象徴的表現,世界のあるべき姿に関する宗教的信念,社会生活を規制する相互作用に関する規則や期待,D
「核家族」が意味するものは次のうちどれか?,住居と食事を共にする人々の集団,世代内あるいは世代間に広がる親族のネットワーク,成人が家を出て結婚したときにできる新しい家族,親とその子供の二世代単位,D
新しい社会運動の台頭が示すのは、次のうちどれか?,人々は現実的な問題や関心事に従って投票する,消費者のアイデンティティは、階級的アイデンティティよりも重要,個人的、文化的、環境的な問題は、経済的利益と同様に政治意識を動員することができる,上記のすべて,D
次の社会学的視点のうち、社会を相互依存的で協調的な部分のシステムとして捉えるものはどれか?,機能主義,コンフリクト理論,象徴的相互作用主義,役割理論,A
ポスト・フォーディズムのメディア生産と消費の形態には、次のうちどれが含まれるか?,受動的な観衆向けの標準化された製品の大量生産,出版社-放送局モデルではなく、制作者-放送局モデルに基づくテレビ,ニッチ市場向けの多様な製品,自動車および自動車関連製品の広告数の増加,C
マルクスは、工場ベースの生産による労働運動の発展は、労働者階級を次のうちどのように変えるであろうと述べたか?,それ自身の階級,それ自身による階級,それ自身のための階級,支配階級,C
「健康転換」の第3段階では、病気と死亡の主な原因は以下のうちどれか?,発疹チフス、麻疹、コレラなどの急性感染症,肺炎、喘息などの呼吸器疾患,ガン、心臓病、脳卒中などの慢性変性疾患,1つのカテゴリーにまとめられないほど多様,C
ボルド（1993）のような社会学者は、西洋文化における拒食症の「流行」の原因を次のうちどのように考えているか?,極端にとられうる一般的に禁欲的で質素なライフスタイル,感情的で、家庭的で、自己主張しないという伝統的な女性像,「正常な」行動パターンが病的にとらえられるという、精神疾患の社会構造,独立した、自信に満ちた女性らしさという新しい理想が、達成と管理という文化的価値観と結びついていること,D
社会階級のような概念を 「運用化」することの難しさの一つは、次のうちどのような点においてか?,定義や指標がまちまちで、有効な比較が困難になる,このような広く議論されている考え方について、信頼できる指標がない,空想的な理論を立てる楽しみがなくなる,そのテーマに関する応用的な実証研究にはほとんど使えない,A
1990年の国民保健サービス改革で、病院は次うちどのようになったか?,保健当局からの購入契約をめぐって競争する自治トラスト,中央政府からの資金に依存している国営の供給業者,保健当局からますます切り離された、民間のヘルスケアの供給業者,医療需要が減少していたため、効率的な経営をする傾向が薄れた,A
法と秩序は1980年代と1990年代に次のうち何を通じて民営化されたか?,民間警備会社の拡大,民間刑務所の建設,警察の業績を測定するための市場規律の導入,上記のすべて,D
「対応原理」（ボウルズ＆ギンティス）が示唆しているのは次のうちどれか?,学校は、子どもたちに従順であることを教えることによって、就労の準備をさせる,教師と親は、学習に対して同じような態度をとる傾向がある,手紙をたくさん書く子どもは、言語をよりよく理解するようになる,男子と女子の学業成績は、最近似てきている,A
階級差別は20世紀半ばのイギリスでは、以下のうちどのような点で明らかであったか?,中産階級の持ち家に住む人たちはジェントリフィケーションを通じて都心部に移動した,労働者階級のコミュニティは都心部で形成され、中産階級は郊外に移動した,中産階級は田舎に住み、労働者階級は都市に住んでいた,上流階級と中流階級が公共の場を支配し、労働者階級の人々はより家庭中心であった,B
チャールズ・クーリーの「鏡に映った自己」理論が強調するのは次のうちどれか?,幼い子供が、自分には別のアイデンティティがあることを認識するようになる方法,他人と同じように自分を見ることの難しさ,他人が自分をどう見ているかという認識に基づいて、自分の自己概念がどのように決まるか,自分の身体的外見によって、自分の自己概念がどのように大きく左右されるか,C
クィア理論は次のうちどのような主張をしているか?,異性愛が正常であり、最も望ましいあり方,私たちが使用する性的カテゴリーや言説は、真の根本的な生物学的差異に基づいている,逸脱した形の男性性は、逸脱した形の女性性よりもジェンダー秩序を脅かすものと見なされる,すべてのセクシュアリティは多元的であり、断片化され、頻繁に再構築される,D
スコット（1991）は「パワーエリート」という言葉を次のうちどれを表すものとして紹介したか?,プロレタリアートから搾取する支配階級、つまりブルジョアジー,財産所有と有利な人生の機会に依存する資本家階級,利益を共有するが、国家権力を持たない階級間の連携,権力ブロックから圧倒的に多く集められたメンバーを擁する国家エリート,D
ある社会学者が、地元の病院で組織の力関係について調査を行っている。その社会学者は数週間その病院のスタッフとして、フィールドノートとしてデータを記録している。この調査方法を次のうち何と呼ぶか?,実験,二次データ分析,参与観察,調査管理,C
シンボリック相互作用論において、ミードは「一般化された他者」を次のうちどのように定義したか?,彼が反発していた社会の構造理論群,私たちが他者に与えようとする自分自身の全体的な印象,私たちに社会の一般的な価値観を教えてくれる幼児期の重要人物,私たちの行動をより広い社会の人々がどのように受け止めるかというイメージ,D
デイヴィス（1995）によれば、女性が美容整形を求めるのは、次のうちどのような理由からか?,根深い無能感があり、コントロールしようと努力している,美のイメージに煽られ、「完璧な」身体を追い求めている,文化的理想との関連で、自分の身体の一部が恥ずかしいものと認識している,パートナーの男性から、スーパーモデルのように見えるよう圧力をかけられている,C
マルクス（1844年）は、資本主義が労働者を次のうちどれから疎外したと主張したか?,自分たちが作っている製品,生産過程,お互い、そして大まかにいうと人類,上記のすべて,D
ハーバーグ（1955年）のアメリカにおける宗教の研究は、次のうちどれを示唆しているか?,少数民族は、文化における社会的受容を得るために宗教を実践していた,主流の信仰は、国家のアイデンティティとますます同一視されるようになっていた,主な宗教の道徳的教えは、比較的類似してきた,上記のすべて,D
構造機能主義者は社会を次のうちどのように表現するか?,ミクロレベルでの複雑な相互作用のネットワーク,紛争、不平等、疎外の源,社会関係の不安定な構造,役割と制度の規範的枠組み,D
ブース(1901)の調査によると、ロンドンで貧困にあえぐ人々の割合は次のうちどれであったか?,30.70%,27.50%,18.60%,33.20%,A
伝統的な労働者階級のアイデンティティは次のうちどれに基づいていたか?,製造業における共通の労働条件,プロレタリアート構成員の階級意識,地域共同体、拡大した親族ネットワーク、共通の余暇活動,中流階級への移行を目指す集団的願望,C
バーンスタインは、言語の「制限されたコード」を使うことが学校での生徒の不利益につながると考えた。理由は次のうちどれか?,この話し方のパターンは彼らをいじめの標的にした,明示的で文脈に左右されない意味を指す,子どもたちが仲間グループの外とのコミュニケーションを取ることを妨害する,短く簡単な文章で語彙が少ない,D
テレワークとは、以下のうちどのような雇用形態か?,電話による相談サービスやホットラインを通じて、自分のビジネスを運営する,IT技術を利用して、外部の雇用主のために自宅で働く,非公式経済を通じて、地域ネットワーク内でベビーシッターやその他の仕事をする,非・手作業とテレビを見るという余暇活動を組み合わせる,B
フランク（1967）は、「低開発」社会は次のうちどのようなものだと主張したか?,国際資本主義経済に十分に関与していない,伝統的な生活様式を放棄したがらない,自分たちを搾取する裕福な国々に経済的に依存している,「衛星」諸国が属する「メトロポール」。,C
旧ソ連のケースは、カーら（1960年）の次のうちどの主張を裏付けているか?,全体主義体制は先進工業技術の要求とは相容れない,民主主義政府は支配エリートの利益に奉仕する,先進工業技術は全体主義体制の権力を強化する,共産主義社会はさまざまな政党の間で権力を分散させる,A
19世紀の印刷革命は次のうちどのような結果をもたらしたか?,大量生産、大量流通、真面目なコンテンツの衰退,共有資源としての新聞の公有化,新たな余暇活動として映画館に行く人の増加,インターネット上の「バーチャル・コミュニティ」の縮小,A
「フェミニストの立場」という言葉が示唆しているのは次のうちどれか?,フェミニズムが軽視してきた問題に立ち向かうこと,女性の視点から社会を研究すること,女性の人生における差異と多様性を認識すること,知識のジェンダー的性質を無視する傾向,B
民俗学的調査が質的データを生み出す理由は次のうちどれか?,調査結果が統計的分析に適している,数年にわたり実施される,内部関係者の視点から、豊かで詳細な記述を発見できる,複数の異なるケースから得られた調査結果を比較できる,C
マルクスは、次のうちどの場合に宗教が消滅すると宣言したか?,道徳的個人主義の新しい潮流が確立された,社会主義革命によって資本主義イデオロギーの必要性を取り除いた,教会の出席率が15％を下回った,人々が科学技術をより信じるようになった,B
グローバリゼーションの特徴でないものは次のうちどれか?,世界全体に対する意識の高まり,国民国家権力の拡大,通信技術による距離の破壊,国境を越えた社会関係の拡大,B
生まれたときよりも高い（または低い）社会的地位を得た人は、＿＿＿＿を経験したことになる。,絶対的貧困,相対的貧困,垂直移動,水平移動,C
調査で、避けるべきである質問は次のうちどれか?,固定された選択肢の質問,短い質問,誘導的な質問,ふるいにかけた質問,C
社会が伝統的な組織形態から近代的、工業的な組織形態へと移行することを示唆する発展理論を次のうちどう呼ぶか?,西洋化理論,近代化理論,工業化理論,依存理論,B
現代社会では、社会的地位は一般的にその人の＿＿＿＿で測られる。,年齢,収入,言葉の流暢さ,職業,D
社会学が常識と異なるのは、以下のうちどの点においてか?,研究者自身の経験に焦点を当てる,世界のあり方とあるべき姿の区別をほとんどしない,その知識は多くの異なる研究文脈から蓄積される,主観的で偏りがある,C
世界を肯定する宗教とは次のうちどれか?,従来の文化的価値を受け入れるが、それを達成するための新しい手段を提供する,教会の教えから意味のある宗教的な内容が失われることに反発する,主流派の社会的価値観に対して穏やかな不承認の態度をとる,従来の社会の目標と手段の両方を否定し、ユートピア的な代替案を提供する,A
パーカー（1976）が特定した「拡張パターン」は、次のうちどのようなものだと言われているか?,余暇をよそよそしい仕事から逃れるチャンスと考える、事務職や未熟練肉体労働者のライフスタイル,仕事の関心が余暇に波及する、専門職や熟練労働者の特徴,半熟練肉体労働者や事務職に見られる、仕事と余暇の間につながりも対立もない中立的なバランス,エッセイ執筆をギリギリまで放置し、締め切りを延ばしてもらう学生の傾向,B
ウェーバーは「階級的状況」を次のうちどのように定義したか?,資本家の雇用主による労働者階級の搾取,自分たちの地位と人生の機会に関する社会集団の意識,経済的資源に基づく、資本市場、製品市場、労働市場における人の地位,消費のパターンによって定義される、社会階級のライフスタイル,C
1980年代、教育政策に市場原理が導入された結果、次のうちどのようなことが起こったか?,高等教育を受ける学生への資金援助の拡大,権限と予算管理のLEAへの委任,保護者による学校選択の減少,全国的なテストと検査による国家規制の強化,D
スミスとトムリンソンが主張したのは次のうちどれか?,民族的背景の違いは、教育の達成度を予測する上で、階級や性別よりも重要,学校における人種差別は、少数民族の子供たちの機会平等への動きを弱体化させた,教育の成功を決定する上で、学校の性格は民族的背景をはるかに凌駕する,教育の達成度における性差は、階級の不平等に起因する可能性がある,C
ベル(1973)が指摘した「脱工業化社会」は、次のうちどれか?,産業紛争の解決における労働組合の力の増大,工業生産と製造業への関心の復活,知識と情報に基づくサービス経済へのシフト,上記のすべて,C
ホワイトカラー犯罪は、次のうちどの理由で認知度が低いか?,それは、わずかな金額しか含まない,プロレタリアートはブルジョワジーを出し抜くことができる,警察は企業犯罪に目をつぶっている,それは、日常の商取引の中では検出されないまま,D
産業資本主義とともに、余暇は次のうちどのことを意味する概念として登場したか?,明確な非労働とくつろぎの期間,社会の混乱を減らすための規制され、組織化された活動,公共図書館、博物館、美術館を通じた市民、自治体の文化の成長,上記のすべて,D
モラル・パニックは次のうちどの場合に起こるか?,メディアが逸脱した集団の報道を誇張し、敵対的な反応を引き起こす,子どもたちが暴力的または性的に露骨な映画を見て、その行動を真似する,視聴者がメディアによって表現された民族的ステレオタイプに異議を唱える,エリート主義者が文化のアメリカ化に懸念を表明する,A
「人口転換」とは、次のうちどのような社会的傾向か?,移民よりも移住の割合が高いことによる人口規模の縮小,工業化以降の主な死因と疾病の変化,出生率と死亡率が上昇し、その結果、人口が比較的若くなる,出生率の低下、平均寿命の延長、高齢化,D
「スノーボール」は次のうちどの例の一つか?,確率サンプリング,非確率サンプリング,クラスター・サンプリング,クリスマス休暇の建設的な利用,B
マルクスが予測した「階級の二極化」とは、次のうちどれか?,それぞれの社会階級が、より特権的なものとそうでないものに分割されること,貧富の差が拡大し、階級意識が生まれること,中流階級における中間層の成長,労働者階級が非常に寒い場所に住む傾向があること,B
19世紀の労働運動の文脈では、「法人化」とは以下のうちどれを意味するか?,政策決定過程に組合代表を参加させること,国家と企業組織との間につながりを持たせること,女性をフルタイムの有給雇用に採用すること,労働者階級の組織を政治的交渉や代表に含むこと,D
米国に入国した何百万人もの移民の子供たちは、定住した地域の公立学校に通いながら、英語と市民としての義務を学んだ。これは、次の社会学的概念のうちどれに当てはまるか?,文化変容,集団行動,社会階層,社会移動,A
資本主義世界経済は、ウォーラーステイン（1974）が「世界システム」と呼ぶものである。この用語は次のうちどれを指すか?,国内の異なる地域間で資金を輸送する手段,官僚的な行政を持つが政治的な中心を持たない帝国,環境全体に影響を及ぼすリスクや危険に対する認識,民族や文化集団を超えて広がる分業体制を持つ単位,D
フーコーによれば、カーセラル組織は＿＿＿＿＿＿＿＿＿。,人間関係と従業員の満足度を重視した,経営者の持つ権力を増大させた,受刑者からそれまでのアイデンティティを剥奪した,人々を隔離し、監視下に置いた,D
次のうち、社会のレベルとして認識されていないものはどれか?,家庭,オフィス,地球村,国家,B
エスニック・アイデンティティとは、＿＿＿＿＿＿＿＿＿＿を指す。,国勢調査で使用される民族の客観的カテゴリー,宗教、言語、歴史に基づく、集団の一員としての感覚,権力ある多数派による、少数派への人種的レッテルの押しつけ,民族性の断片的で多元的な性質,B
結婚が減少しているように見えるのはなぜか?理由を次のうちから選べ。,一人暮らしの人の割合が29%に減少している,多くの人が長期的な交際の中で同棲している,再婚の増加曲線が初婚の減少を補っている,上記のすべて,B
