国家福祉の市場モデルは、以下のうちどの原則に基づいているか?,個人が個人的に福祉を購入し、資産調査に基づいた給付金を受ける,「家族賃金」の稼ぎ手である男性に、定期的に給付金を支払う,収入に関係なく、すべての人に福祉を提供する普遍主義システム,国家による提供を通じて、社会福祉を脱商品化する,A
貧困の女性化という用語は次のうちどれを指すか?,フェミニスト理論家たちによる「貧困」の批判的脱構築,低賃金と福祉への依存度の高さによって、女性が貧困に陥る可能性が高まっていること,家計を管理し、貧困を回避することが、家庭内では女性の責任になりがちであること,貧困について研究する女性社会学者の数が不均衡であること,B
次のうち、新しい形のコミュニティとして認識されていないものはどれか?,共通のアイデンティティと差別体験に基づく民族コミュニティ,大都市の一部に形成されるゲイ・ビレッジ,不人気講師によって形成される社会学的コミュニティ,サイバースペース上にのみ存在するバーチャル・コミュニティ,C
19世紀における「契約労働」の使用には以下のうちどれが含まれていたか?,イギリスの植民地に移送され、劣悪な条件の下で1つの雇用主のために働かされた人々,「大西洋の三角地帯」における奴隷貿易によるアフリカ人の売買,工場で最も熟練した労働者を選んで、雇用主の会社を海外に宣伝する,彼らが話すのを止めるために、最も怠惰な労働者の歯を抜く,A
文化的再編成には以下のうちどれが含まれるか?,経済的に衰退した都市を再生させること,産業景観を観光名所に変えること,メディア広告の「象徴経済」を通じて、名所やイメージを売り込むこと,上記のすべて,D
ウェーバーの理想型官僚制度の一部ではなかったものは、次のうちどれか?,非人間的な規則,広範な事務処理,役人のヒエラルキー,給与,B
幼児期における社会化の最も重要な仲介者は次のうちどれか?,幼児教育の提供者,仲間グループ,マスメディア,家族,D
次のうち、「研究目的」でないものはどれか?,三角測量,説明,記述,探索,A
